9823r6	Education Lounge: Share/Rant/Discussion Fridays - August 17, 2018	education
9w3dbb	Going to College Is Different in the Age of Campus Shootings	education
9w5tjt	Good accessories to use while studying a degree	education
9w5pqx	Why Colleges Continuously Fail to Get It Right When It Comes to Our Veterans	education
9w00sv	Free Plagiarism Checker	education
9vv42m	Supreme Court says WVU's public-private partners don't have to pay property taxes	education
9vwyfd	Why are you still teaching?	education
9vwqug	It ended in 1767, yet this experiment is still linked to higher incomes and education levels today	education
9w0ii0	Mixolydian Scale	education
9w07ja	Opinion | Why Are We Still Teaching Reading the Wrong Way?	education
9vwxyy	'Three Point Circle Study'	education
9vjpvn	'Phenomenally saddening': inside the sordid world of America's for-profit colleges	education
9vo8z9	'Trigonometry Visualization of Sin and Cos' [Animation]	education
9vscc2	These AR wooden toys are being used to enhance hands-on learning	education
9vqnni	VIDEO: What Will The 2018 Midterm Elections Mean For Education?	education
9vjkl3	The Backlash Against Screen Time at School	education
9vda49	A teacher defaulted on $55,000 in student debt—loan rehabilitation offered hope, but now he owes $130,000	education
9vnymp	A Discovery-Driven Approach to Blended Learning	education
9vjbib	Microsoft Made by Dyslexia: Technology Assistance for Dyslexic Children in 8 Ways	education
9vnkex	Armistice Day Centennial. A 5-minute (or so) musical exploration of current events and history. "Making popular education popular again."	education
9vn2ui	Are Unpaid Internships Worth It?	education
9vorl2	California Teachers Unions Oppose Paying Teachers More Because It Would Introduce Too Much Competition Into Public Schools	education
9vmbq9	Personal Finance education channel	education
9vlvde	“We Don’t Want to Live a Long Life in Fear”	education
9vfafz	Milestone: Sarah Fortney elected first openly gay School Board member in Florida	education
9vdb5r	Why are school trips so important in any education system?	education
9vgdos	Why doesn’t google should information for foreign colleges?	education
9v9w3p	How to Succeed As a Working Student	education
9v2vz3	UPenn student writes op-ed arguing for donors to stop giving to Ivy League universities, instead focusing on state schools	education
9vawmg	A Mass Shooting in One of the ‘Safest Cities in America’	education
9vfhdi	'Fourier Circles' [Animation] - KTBYTE Projects	education
9vavhr	Wright State faculty union rejects fact-finder's report	education
9vbrg2	How AI Enhances Collaborative Learning	education
9vdpe9	How Americans Feel About Affirmative Action In Higher Education	education
9v9f6l	The Questionable Year of the Teacher Politician	education
9vbr4b	Language Immersion K-5 Graduates: Did you retain your target language?	education
9v2m8m	We Should Teach Media Literacy in Elementary School	education
9vakpv	Early-Career Enhancers in Education Is On the Rise	education
9uwp00	Jahana Hayes, National Teacher of the Year 2016, wins House seat becomes first black congresswoman from New England	education
9v6url	Help!	education
9v26id	A Lesson From Montanans’ Vote to Tax Themselves to Fund Higher Education	education
9v17tz	Review of research finds small benefits to small classes	education
9v2l1e	Here’s how the midterm-election results could affect student-loan borrowers	education
9v52uc	Does applying to the same University for 3 totally different degrees lower my chances for the more sought after/competitive selection?	education
9v528p	'Ray-Sphere Intersection v1.2'	education
9utgwf	From South Carolina to California, charter school-loving billionaires are plowing money into midterm local and education races	education
9v3y29	Why Students Are Terrified (to Speak Their Minds)	education
9v21sh	Debt Levels up 20% from Last Decade for College Grads	education
9uzmr1	ELI Your Student: Charter School Opposition	education
9uz3s5	The Diploma Divide	education
9v03gn	Kids Needs to Do More Than Just Read Books to Learn	education
9uploe	Why did you decide to become a teacher?	education
9utp2g	Im intrested in studying pedagogy and teaching, and I am wondering if there is any introductory sources to the subject	education
9utcto	'Circle through 3 points' [Interactive]	education
9ut4bo	Why are people so judgemental about degrees?	education
9ush9b	Starting out as a teacher	education
9urq25	Is this true that you can get kicked off school for cheating?	education
9udzbp	Democrats Are Using Betsy DeVos in Their Campaign Ads and It’s Working	education
9ultml	Should I Go to Trade School or College?	education
9uessg	Idaho Teachers Who Dressed Up As Mexicans And The Border Wall Suspended	education
9umsh4	Does handwriting influence grades?	education
9uehyk	What Educators Say They Need to Integrate Wellbeing into K-12 Education	education
9uhs5h	IS THIS NORMAL: English Class Teacher Brings Ouija Board to Class and Has the Class Use It	education
9uiz1r	Calculators	education
9u80em	Still undecided about the midterms? Here's a candidate: public education.	education
9ui9v8	'Ellipse Collision' - KTBYTE Projects	education
9ucqvk	Do all standardized tests fail to predict college or professional success?	education
9ue3qa	40% Of Borrowers May Default On Their Student Loans	education
9uegz3	How VR Changes Learning	education
9ugh77	The Candidates Embracing Their Black-College Roots	education
9ucmbo	Combination of Machine Learning and Artificial Intelligence ?	education
9ug68o	Asking opinions about machines making degrees obsolete	education
9ug1t0	Former Street Beggar and Rickshaw Driver Opens Orphanage and Two Schools (Ilmfeed)	education
9ufw14	What would you think of a school board member who sends their child to a private school?	education
9ufr7h	Survey shows role of activism and politics in college decision process | Inside Higher Ed	education
9u6gyd	Millennials with student debt are buying smaller homes with bigger mortgages	education
9ucpgy	General discussion about selecting an appropriate location for pursuing master's program in the field of computer science.	education
9u5361	9 Things You Need To Know About Education And Tuesday's Election	education
9u6j2s	A top London university business school is using hologram lecturers to teach	education
9ual7u	Test Your Whole Tone Scales	education
9u8peo	Montessori & Charter schools hmm?	education
9uabi1	The Care And Keeping Of History	education
9u0syi	Perspective | Academia is a cult	education
9u6r87	'Pendulum Wave Effect' [Interactive] Press N and S for more variations.	education
9tv1jo	Why Are We Still Teaching Reading the Wrong Way?	education
9tv5u7	Elementary school teachers in Idaho dressed up as a MAGA border wall for Halloween	education
9tzjj6	I need out-advice?	education
9twlv8	'In school, but learning nothing'	education
9tv37p	Sarah Lawrence Professor's Office Door Vandalized After He Criticized Leftist Bias	education
9tqccw	Student-Loan Debt Is Crushing Millennials	education
9trzt1	New study: Almost half of borrowers will default on student loans...	education
9tustj	World's first Blockchain-Based University	education
9tx5pc	'Angle Study' - KTBYTE Projects	education
9tlfq1	Idaho teachers dress up as border wall, Latinos for Halloween	education
9tsfyd	Why Do Japanese Always Win The Nobel Prize? These 9 Educational Methods Are Worth Learning	education
9trxkw	What are the advantages of leave management system?	education
9tgqat	New Report Finds Student Debt Burden Has 'Disastrous Domino Effect' On Millions Of Americans	education
9tn2tt	The End of the Beginning of the Harvard Trial	education
9thqm8	When police team up with ICE, it ripples into classrooms	education
9tkmdd	With a High School education, you have a 4.2% chance of becoming a millionaire (Vs. 13.5% with a college degree)	education
9tnke7	SWOT of lesson plan	education
9tkcl9	There's a Downside to Attending an Academically Selective School, Study Says	education
9tnevd	Most women regret not putting more effort into school as teenagers but some wish they weren't so focussed on their academics	education
9tkgh3	Academics Shouldn't Sell Out Truth for Justice	education
9tm6lh	The Most Powerful Words In Education	education
9tifsj	What is an A supposed to represent in US high school?	education
9t9xyp	These 2018 Candidates Want to Eliminate Your Student Loan Debt	education
9tfklt	Harvard on Trial: Chinese and Chinese American Responses to Affirmative Action	education
9teq4f	Report: NYC Charter Schools Experience Greater Principal Turnover than Traditional Public Schools	education
9tdkjk	'Lissajous Visualizer'	education
9tfd6o	Recently Updated Media Literacy Site	education
9ted60	How to Study For The MCAT? Follow These Top 10 Study Habits	education
9t8h7d	Haim Ginott 1972 "Teacher and Child" quote - what's the page number?	education
9taw5d	Colleges Make an Advertising Push for the Humanities	education
9tcwad	Faculty strike looms at Wright State	education
9tb0et	Unsure of primary source	education
9taoco	Teachers - what are your reasons for not adopting a new classroom methodology?	education
9t8fxa	Phonics I'm e-book form?	education
9t8v3s	3 Reasons why Schools are encouraged to go into Blogging	education
9t84u2	Using formative assessments to improve forming of answers on tests by (young) students (history)	education
9sy0i6	Education philanthropy: why the billions spent aren’t working	education
9t7wgh	Advantages and disadvantages of crazy expensive private schools	education
9t2h0p	Handshake, high-five, fist bump or hug? Cute preschoolers choose which fun way they will greet each other every morning	education
9t56sb	Why is there an SAT Math level 1 Test?	education
9t4q6v	Online education startup idea , I need your reviews please .	education
9szki6	Do employers look down on online degrees?	education
9t1n8u	What is a Good ACT Score? Answers From the Best	education
9szhj6	7 Ways Schools can Use the Canva Graphic Tools to a Benefit	education
9t0bpk	Help with Uni	education
9sxee1	Which is the best video tutorials for learn LMS…?	education
9snlu7	Research shows that mixed practice (i.e. interleaving) leads to better learning outcomes in a variety of contexts, in comparison with traditional blocked practice.	education
9t21k7	3 Reasons Why Most Entrepreneurs FAIL. Here's your weekly nuggets of wisdom from the FourPercent Entrepreneur Show by Vick Strizheus. Must watch if you want to be successful and dominate the online world. If this resonates with you go to "JOIN" on the right hand corner to create a free account and	education
9snuvi	John Taylor Gatto (1935-2018): Remembering America's Most Courageous Teacher	education
9sqniw	Kids' apps may have a lot more ads than you think	education
9ssslb	50-Plus Questions You Need to Ask When Visiting Colleges	education
9sr012	How College Promise scholarship programs can revitalize distressed communities	education
9soc0g	What Jewish Schools Are Telling Students About the Pittsburgh Shooting	education
9spu08	The Overlooked Reason One in Five Teens Struggles With Homework	education
9svizr	I already shared this to another subreddit:	education
9sn2bj	Impact Of College Ranking On Admission Trends- If modern education trends are to be believed, a major portion of student population prefers to survey online college rankings before considering a college admission. Read More	education
9sp8hs	The Truth about Education in Uganda	education
9sl4je	Teachers: What Swag would you actually use in your classroom?	education
9so008	Tips & Tricks Best Exam Revision Techniques	education
9snp6h	Martha Nussbaum; Not for Profit	education
9skr5p	Some Seattle school PTAs can afford extra teachers. Should they spread the wealth? (xpost /r/SeattleWA)	education
