9eccrv	Billionaires v teachers: the Koch brothers' plan to starve public education: “The Koch brothers and DeVos are trying to do everything they can to divert money that should go to the public-school system, where 90%-plus of students go,”	education
9xbfld	As Humanities Majors Decline, Colleges Try to Hype Up Their Programs	education
9ldlg6	One strategy to boost students' test scores: help low-income families	education
9apb30	For-profit charter schools would be banned under California bill heading to the governor	education
9a0k2p	Texas Public Schools A-F Ratings: Is 'A' for Affluent? (x-post r/dataisbeautiful)	education
9obpnf	The Harvard Case Is About the Future of Affirmative Action	education
9ey166	University of Pennsylvania Philosophy Stops Requiring the GRE	education
8fedwk	More than 9 in 10 elementary school teachers feel highly stressed, MU study finds - "Research shows high stress classroom environments yield poor student performance and behavior"	education
9cy03w	How to Teach White Kids About Race	education
90gqx4	The Astonishing Inheritance Figures That Sustain the Black-White Wealth Gap	education
886wjq	Poor grades tied to class times that don't match our biological clocks	education
8p1o2d	Nearly 1 in 5 Maryland students is chronically absent. At some schools, the rate is more than 75 percent.	education
7pmzo6	Louisiana school board president on teacher arrest: Everyone wants to side with the 'poor little woman'	education
882jm3	Poor grades tied to class times that don't match our biological clocks	education
7k88jd	Lots of Poor School Districts Do Pretty Well, But We Don’t Know Why	education
8b6mg1	The Corporate Plan to Groom U.S. Kids for Servitude by Wiping Out Public Schools	education
8v4692	Free education?	education
88w9ym	School segregation in America is as bad today as it was in the 1960s	education
87xj1n	Oklahoma teachers are fed up and walking out on April 2.	education
8f66oy	Teachers in Arizona and Colorado Walk Out Over Education Funding	education
8vvcts	The Era of Affirmative Action May Not Last Much Longer	education
7x0mam	Turnitin - still robbing the poor to feed the rich	education
8kcwfx	College is Worth it for Persons From Low-Income Backgrounds (Upjohn Institute response to NYT op-ed)	education
8lk60w	College Does Help the Poor	education
8bv6vx	Revealed: Secret rightwing strategy to discredit teacher strikes	education
8na42h	One College's Struggle to Get Poor Students Through School	education
7szubo	In New York, Rich Disabled Kids Get the City to Send Them to Private School. Poor Disabled Kids Get Screwed.	education
83whwu	WATCH: Betsy DeVos tries and fails to answer basic questions about education	education
8diqwc	The Wave of Militant Teacher Strikes Has Gone Global. Just Look at the UK.	education
8lt4ng	The Schools That Are Bringing Poor Kids Into the Middle Class	education
7htsj2	America’s Lost Einsteins - Millions of children from poor families who excel in math and science rarely live up to their potential.	education
84vd2j	Study says kids who are considered old for their grade are more likely to go to college—these students appear to feel more confident than their younger classmates about their academic abilities	education
8g80eb	The University of California Stands Out Among Top Schools When It Comes to Serving Poor Students	education
8l9f7c	Do you know any interesting Alternative education methods or techniques?	education
7bx558	‘A Tax on Poor People’: San Diego Unified Sends Parents Who Can’t Pay for School Bus Rides to a Collections Agency	education
8gphn8	Tax break for Parents of Students who perform well in public schools	education
800962	San Diego may eliminate library fines to avoid cutting off the poor	education
8nub5n	Are you in debt? Atlanta ranks No. 2 in US for cities with most student loan debt	education
89buu2	how can we describe our current education system?	education
6qapqu	Study: Poor Kids Who Believe in Meritocracy Suffer	education
6pafyj	Luring good teachers to poor schools not so easy, Fulton finds	education
85m6wz	Parents raise massive amounts of money at some public schools. Should they share it?	education
613aki	Wisconsin Republican urges cuts to college aid to keep poor students from buying ‘goodies and electronics’	education
7fvrqz	Arizona wrongly distributed $62 million in federal aid for poor students over 4 years	education
652yyd	Jon Hamm: Paying teachers more is 'one of the most obvious things we could do to improve life'	education
6cuedi	School choice is a scam in segregated neighborhoods	education
7jkpqe	teachers and Admins of reddit, how should we teach students about personal Finance?	education
6hmuw2	"private schools do a better job of attracting—not producing—high-scoring students."	education
3t7etl	This Brilliant Comic Strip On Rich Vs Poor Upbringing Will Humble You	education
74fjwy	For-profit charter schools collect taxpayer money for empty desks	education
6bi774	Study of the Week: What Actually Helps Poor Students? Human Beings	education
5wx3bp	HBCUs Graduate More Poor Black Students Than White Colleges	education
5x5l5x	"These colleges are better than harvard at making poor kids rich" -an interesting article about access to institutions of higher education for poor students	education
6n9nng	“Education is the only tool to reduce poverty and inequality”	education
5eixou	Our next Secretary of Education has never set foot in a public school and has no background in education. What will this mean for those of us in the trenches?	education
6d9ast	Betsy DeVos Refuses to Rule Out Giving Funds to Schools That Discriminate	education
75qc57	DeVos champions online charter schools, but the results are poor	education
4vwxsp	Outstanding schools take too few poor pupils, study says	education
7b03w9	New research finds it hasnât gotten easier for poor kids to catch up	education
81seva	Pakistan is home to the most frenetic education reforms in the world	education
1jzoxh	Please help. Teaching 3-5 in a very poor area. Half kids have IEPs, other half has crisis plans. I'm ready to give up and it's only been a week.	education
4uiqjg	The Kindergarten Shock. Some children are already behind their peers when they set foot in kindergarten, setting them up for an uphill climb that could last years. It’s not just a wealthy versus poor gap, either.	education
5bhzq3	Later start times better for high school students: Poor self-regulation in teens linked to circadian rhythms.	education
69kh4u	Health Care Bill Hits Special Ed; Trump Touts D.C. Vouchers Despite Poor Test Scores	education
72uq1a	Preschool instructors appear to lack the knowledge, skills and confidence to effectively teach their young students science – a problem that is likely contributing to America’s poor global performance in this crucially important subject.	education
69ntvl	UC Santa Cruz agrees to all demands from black student group	education
5tt5n7	I believe local public schools are crucial for a peaceful and prosperous society.	education
75sia6	Why Professors Use Powerpoint Slides or PDF Slides to Teach	education
614tvj	Examining Poor School Performance in the U.S.	education
709jpf	The subtle ways colleges discriminate against poor students	education
6iwlxj	1/3 of Americans will be diabetics by 2050. This is why we need Healthy Cooking Class at School.	education
620eft	We Know Why Teachers Leave Poor Schools – But Not How to Make Them Stay	education
6ue42z	My school allows college sweaters: Should military sweaters be allowed?	education
6k17ii	School leavers from poor families more likely to be unemployed, regardless of subject choice	education
7me7hi	The Biggest Education Stories Of 2017 And 2018	education
3xahv7	Only in America: Four years into life, poor kids are already an entire year behind	education
6pfvm7	Teachers Don’t Know Much About South Asian American Students	education
6axiss	Opinion | Why getting rid of grades would help rich students â and hurt poor ones	education
5ppbdl	Obama administration spent billions to fix failing schools, and it didn’t work	education
60spyb	Survey: U.S. High Schools Seen as Easier By Exchange Students	education
6dddwr	Music education makes for a poor commodity	education
4z1ufl	Rebutting Melinda Gates: Teachers are not the problem, poverty is	education
702cow	The Controversy Behind Chicago's Diploma Mandate	education
5vbgl3	For-Profit Schools, an Obama Target, See New Day Under Trump	education
5o2j29	5 Big Ideas In Education That Don't Work	education
5zfzzo	USA Today runs the numbers and finds Charter schools do well at high school graduation rate, but fall off a lot in seeing their alumni graduate from college	education
78i83x	One Libertarian admits, after 20 years of trying, school vouchers appear to be fool's gold	education
3u2pf1	Poor boys are falling behind poor girls, and it's deeply troubling.	education
396qk7	The rich are 8 times likelier to graduate college than the poor	education
4syxyz	Where Books Are All But Nonexistent: In many high-poverty urban neighborhoods, it’s nearly impossible for a poor child to find something to read in the summer.	education
6e1f4z	Top Colleges Doing the Most for the Poor: The NY Times third annual College Access Index, a ranking of colleges based on their commitment to economic diversity.	education
7302jr	What's Lost When Only Rich Kids Play Sports	education
43az33	What is it like to be poor at an Ivy League school? High-achieving, low-income students, often the first in their families to attend college, struggle to feel they belong on elite campuses.	education
32scje	New brain science shows poor kids have smaller brains than affluent kids	education
6pix7j	What It Takes to Mentor Poor Kids	education
5yrddd	Teacher rant...	education
50j7m9	Corporate backed Pro-Charter School Group Is Shelling Out $100,000 To Attack John Oliver	education
569vrx	America Is Turning Into a Confederacy of Dunces: Why is Donald Trump within a whisker of the White House? Two-thirds of the country can’t even name the three branches of government.	education
6j4wfj	It's official, FGCU will lose $8 million in funding because of poor scores	education
6aoxhx	Money to prep poor kids for college? Sorry, wrong font	education
5yxv9b	China admits political education for students is poor	education
5p0qsd	DeVos Didn't Say: Charter Schools Fuel Resegregation	education
6ep6g9	How Education-Funding Formulas Target Poor Kids	education
5yheet	Perspective | What the numbers really tell us about America’s public schools	education
25fh19	Good teaching, poor test scores: Doubt cast on grading teachers by student performance	education
1j11b8	Abolish Summer Vacation: It's a Disaster for Poor Children and Their Families	education
63jwea	Education = decrease poverty?	education
2araki	Why Poor Schools Can’t Win at Standardized Testing: The companies that create the most important state and national exams also publish textbooks that contain many of the answers. Unfortunately, low-income school districts can’t afford to buy them.	education
5hcb1b	NAACP moves ahead with its call for moratorium on charter schools	education
29hb71	Five Facts for the Dangerously Deluded Education Reformers | 1. Privatized Education Steals from the Poor, Gives to the Rich. 2. Testing Doesn't Work. 3. The Arts Make Better Scientists. 4. Privatization Means Unequal Opportunity for All. 5. Reformers Are Primarily Businesspeople, Not Educators.	education
2hogdr	The lasting effects of poor dress code policy and enforcement	education
37qeu4	According to an estimate by a U.S. education company, some 8,000 Chinese students were expelled from American universities last year alone – and the main reasons were poor grades and cheating.	education
1vfwq3	The Danger of Telling Poor Kids That College Is the Key to Social Mobility: Higher education should be promoted to all students as an opportunity to experience an intellectual awakening, not just increase their earning power.	education
5rodnh	Nevada's 'Super Voucher' Failed to Save Poor Students	education
5avahn	Proof You Shouldn’t Blame Teachers For The Achievement Gap	education
5vk2u4	A once-Great School district in illinois forced to ask voters for tax increase following several years of poor state funding	education
6mmyui	How We Are Ruining America	education
7aylwi	Brown v. Board according to "Black-ish"	education
27vfpa	Will California's Ruling Against Teacher Tenure Change Schools? -- A judge said the state discriminates against poor and minority students by protecting the jobs of ineffective instructors. What will this mean for education?	education
lzdsz	As a spouse of a teacher in a poor district, this is too true. [x-post from pics]	education
52a7h4	Seattle's Highline School District struggles with fallout after limiting student suspensions	education
3w81dz	More jobs require computer skills than ever. Nonetheless, at the same time, there’s fewer opportunities for kids to study computer science. This is particularly true in poor school districts and districts with large numbers of minorities, according to a recent survey by Google and Gallup.	education
46qf6q	A college degree is worth less if you are raised poor	education
21i78g	Sixty years after Brown v. Board of Education, public schools in one of the most racially diverse states in the country — New York — are the most highly segregated, with minority and poor students increasingly isolated by race and class.	education
3q5x4v	‘Forced busing’ didn’t fail. Desegregation is the best way to improve our schools.	education
2k8sl8	Why is bilingual education ‘good’ for rich kids but ‘bad’ for poor, immigrant students?	education
4vd6qc	Infographic: Police Aren't Killing Blacks Or Whites. They Are Killing Poor People Without Highschool Degrees	education
4py913	America's Not-So-Broken Education System	education
1ibuoj	"Higher education was supposed to be a way for poor, smart kids to increase their professional options, not to be punished for how they were born. And now it is a system that makes poor kids even poorer through debt [...] This is aristocracy masquerading as meritocracy."	education
3m4el2	Education Gap Between Rich and Poor Is Growing Wider	education
5ojq4f	Cleveland, Ohio schools penalized for poor charter oversight. Maybe, no one's quite sure...	education
4gpcme	More Educated, More Liberal	education
56840k	Why Busing Didn't End School Segregation	education
4nr5rz	China Tries to Redistribute Education to the Poor, Igniting Class Conflict	education
43lfzm	Why Are American Colleges Obsessed With 'Leadership'? - "What's wrong with being a follower? Or a lone wolf?"	education
4fsop0	If the state gives equal dollars to every student why are poor neighborhood schools always poor?	education
4powtb	Chris Christie Thinks Schools in Poor Black Neighborhoods Have Too Much Money	education
4vrfp4	As loans replace student grants, the poorest graduates will leave with the most debt	education
42svi0	"I Am the Student Loan Crisis at Its Ugliest: I Graduated and Found Out I’m $200,000 in Debt"	education
3zvmm8	Mom: What do I expect from my children's elementary school? Certainly not this.	education
3txcq1	Children from high-income families are exposed to 30 million more words than children from families on welfare. Follow-up studies showed that these differences in language and interaction experiences have lasting effects on a child’s performance later in life.	education
4zfamq	Connecticut Makes it Hard for Poor Students to Escape Standard Public Schools; Sued Over Practice	education
4jvdwb	Why There’s an Uproar Over Trying to Increase Funding for Poor Schools: Rich schools within districts tend to receive more government funds, and the secretary of education has angered entrenched interests in trying to change that.	education
3po13j	Shocking Report: US Privatized Charter School Program Riddled With Fraud, Abuse And Waste	education
15c86v	For Poor, Leap to College Often Ends in a Hard Fall	education
4n11ao	American schools are becoming increasingly segregated and racist - Survey	education
5q69cz	A new(?) idea for teacher pay	education
28nvvr	Arizona Republican schools chief outs himself as anonymous Internet troll who calls poor people ‘lazy pigs’	education
4fe85o	How School Funding's Reliance On Property Taxes Fails Children : NPR	education
20v80u	Are Charter Schools Really 'Helping Poor Children'?	education
4xeivo	Why Poor Schools Canât Win at Standardized Testing	education
2vezp4	School quiz: Conservatives believe helping poor ‘is a waste of money’	education
3myh23	Education Secretary: Want to save on prisons? Spend more on schools.	education
266sty	US 'in denial' over poor math[s] standards	education
3mdman	New Data Reveals Stark Gaps in Graduation Rates Between Poor and Wealthy Students	education
33lm0g	Texas Sends Poor Teens To Adult Jail For Skipping School -- More than a thousand Texas teenagers have been ordered to lockup on charges that stem from missing school, often because they have unpaid court fines. The costs to their education are high. Some, like Serena Vela, never go back.	education
412unx	5 Ways Elite-College Admissions Squeeze Out Poor Kids	education
4nyas9	Title I: Rich School Districts Get Millions Meant for Poor Kids	education
2c6kr8	My son has been suspended five times. He’s 3 - Black families fight entrenched prejudices to get fair discipline for their children in schools.	education
3n3owt	International Teachers in poor and developing countries I have a question for you.	education
3xuk33	NYU Advises Student Not To Apply Because They Are Too Poor.	education
3f6dwl	Private schools are booming in poor countries. Governments should either help them or get out of their way	education
3hlt4z	I was a poor student in college, now that I'm fairly successful professionally, I want to apply for a Mitchell Scholarship.	education
1qhqvh	Poverty Is America's #1 Education Problem. Teachers' unions are not the reason America's schools are in trouble.	education
3rjwpq	Mississippi Voters Reject Guaranteed Public School Funding	education
13xyhs	One in Five Charter Schools Should Close on Performance - "As many as one in five U.S. charter schools should be shut down because of poor academic performance, according to a group representing states, districts and universities that grant them permission to operate."	education
35getf	Why My Charter School Needs a Union	education
4hl4u0	"Like the U.S., the U.K. is facing a growing imbalance in the number of men going to college—but is doing more to target its main minority group of poor white males."	education
35pa4y	Why Don't They Come? It’s not just the price of admission that’s keeping poor and less-educated adults away from arts events.	education
j4pf4	Extraordinary teaches can't overcome poor classroom situations	education
2ih0e5	Why Finland's Schools Are Top-Notch | Finland has built a school system that has over time strengthened educational equity. Teachers have time to work together with their colleagues during the school day. Play constitutes a significant part of individual growth and learning in Finnish schools.	education
4etwu1	In a win for unions, appeals court reverses ruling that threw out teacher tenure in California	education
26296q	If you look at who actually graduates by age 24 with a college degree, it is predominantly people who come from the upper quarter of the income spectrum. For everyone else, graduation rates are poor.	education
1r0mp1	Founder of Udacity: Students fail because they have the gall to be poor.	education
1agw6d	Better Colleges Failing to Lure Talented Poor	education
pj1fa	Education Gap Grows Between Rich and Poor, Studies Show - NYTimes.com	education
3vf4n1	[Radio] Wyoming Schools Get Poor Report Card For Native American Absenteeism	education
41c1fe	'I wish my teacher knew...': Young students share their worries in notes	education
2cbuy7	Eric Cantor farewell speech: Education of the poor is today's Civil Rights Movement (30 seconds into video)	education
3bl2fr	Sorry, Walmart: Charter Schools Won't Fix Poverty	education
23vcrv	A 13 year-old's slavery analogy raises some uncomfortable truths	education
2etjg8	Generation Later, Poor Are Still Rare at Elite Colleges: Surveys of top colleges found virtually no change from the 1990s to 2012 in enrollment of students who are less well off despite a huge increase in the number of such students going to college.	education
48d0ox	The Consequences of Poor Science Education in Kindergarten	education
5mdg7z	Education Lounge: Share/Rant/Discussion Fridays - January 06, 2017	education
28ewla	Too Poor For College, Too Rich For Financial Aid	education
41wduy	Rats, roaches, mold – poor conditions leads to teacher sickout, closure of most Detroit schools	education
5zxg08	Education Lounge: Share/Rant/Discussion Fridays - March 17, 2017	education
2n0gpz	Teens Are Sharing Gross Pictures Of Their School Lunches With The Hashtag #ThanksMichelleObama	education
4p9nat	The #1 Reason for Poor Student Performance	education
ey68r	Wealthy school districts score perfect 10s, poor districts, not so much.  Our problem is POVERTY	education
1pte52	Chris Christie to teacher - "I'm tired of you people. What do you want?"	education
6aqf21	The Promise And Peril Of School Vouchers	education
3c0pdl	Stanford Will Now Be Free To All Students From Families That Earn Less Than $125,000 Per Year	education
n6gz1	What real education reform looks like.  Teachers unions aren't the problem. Poverty and punitive funding formulas for poor schools are	education
3knxyz	Meet Hank Green, one of America’s most popular science teachers	education
osxbj	The poor get poorer and the rich get richer with Apple's iPad-based textbooks	education
1ccv9t	NYT says teachers are happier than people think because they laugh and smile daily, but poor school leadership increases frustrations.	education
2jtrra	Poor kids who do everything right don’t do better than rich kids who do everything wrong	education
3skjjg	"Students were set to walk out of classrooms across the United States on Thursday [12 November 2015] to protest ballooning student loan debt for higher education and rally for tuition-free public colleges and a minimum wage hike for campus workers."	education
pl53e	Occupy Kindergarten: The Rich-Poor Divide Starts with Education	education
1qv3b1	What I learned at law school: The poor need not apply	education
2a9eij	It’s harder to be a poor student in the U.S. than in Russia	education
4gnpi6	Can technology help teach literacy in poor communities?	education
3n8kpb	Education Secretary Arne Duncan to step down at end of year	education
2ay6ml	Is calling somebody a "spastic" offensive? Should teachers use a teaching resource that states that a person with poor grammar "writes like a spastic" in a classroom?	education
49fwnd	Science students get better grades when they know Einstein and Marie Curie also struggled	education
15dshn	For the Poor, the Leap to College Often Ends in a Hard Fall — the Class Divide in Higher Education is Getting Even Worse	education
2dr7zj	Arizona Tea Party leader and school board member votes against approving free and reduced lunch program. Claims parents need to attend AA and work harder.	education
37i83d	The Case Against High School Sports	education
29an3a	Resignation letter from a first year public school teacher	education
2umyxy	Parents attempting to ban a book exposing poverty and the side of America that goes unseen.	education
1797bn	Why Smart Poor Students Don't Apply to Selective Colleges (And How to Fix It) - Derek Thompson - The Atlantic	education
3a0rv9	Sesame Street helps poor kids learn faster	education
4epwjn	Here's why kids fall behind in science	education
2u2rhz	Atheist Teacher Claims He Was Fired for Objecting to Christian Proselytizing in Public School	education
42nzkn	National Teacher of the Year finalist from Tacoma, Wash. explains why he's tired of having educational policy debates	education
2f4iby	Good teaching, poor test scores: Doubt cast on grading teachers by student performance	education
3xz8wd	Lunch lady in Pocatello, Idaho fired for giving one free lunch. Help support her on the GoFundMe page in the comments.	education
ndylk	Excuse Me: I'm The Poor Black Kid You Keep Talking About | Political News and Opinion from a Multicultural Point of View	education
656nud	Chicago Has a Controversial Plan to Prepare Students for Life After High School	education
fy20y	The Case Against Charter Schools — Poor equity & access; scores worse than public schools; less parent/community empowerment; weakening of teachers' unions | ISR	education
27l0cc	School Spending Increases Linked to Better Outcomes for Poor Students	education
1ymrc3	College inequality: Selective schools don't have any poor students.	education
xbd4u	Growing up poor may be the biggest source of stress for many public school children. This education initiative is tackling that problem head-on	education
435rfc	A Bold Shift to Make Public Schools Serve Poor Students	education
29kla0	Words Rich People Use That Poor People Don't	education
1osxbx	Study: Poor children are now the majority in American public schools in South, West	education
24um8n	US Teachers Nowhere Near As Diverse As Their Students	education
2xgb78	Cities are becoming more affluent while poverty is rising in inner suburbs — and that has implications for schools	education
3xu3qw	Study: Poverty Alters Intellectual Development by Stifling Genetic Potential	education
44j496	Wanted In China: More Male Teachers, To Make Boys Men	education
pzb3a	Chicago schools charges students money for having poor behavior.	education
1bh4g6	Bill to cut welfare benefits of parents whose children perform poorly in school clears TN House and Senate committees	education
