2f4uii	Segregation Now ... | While segregation as it is practiced today may be different than it was 60 years ago, it is no less pernicious: in Tuscaloosa and elsewhere, it involves the removal and isolation of poor black and Latino students, in particular, from everyone else.	education
3r37oh	Charters grapple with admission policies, question how public they should be	education
11396f	For Poor Schoolchildren, a Poverty of Words - NYTimes.com	education
2jid9t	Robert Reich: Why Government Spends More Per Pupil at Elite Private Universities than at Public Universities	education
mjeee	Gingrich advocates for relaxing child-labor laws, putting young poor kids to work to replace unionized janitorial work	education
2ftfak	The difference between the poor, the middle class, and the wealthy.	education
1q7b4t	Teachers Were Never The Problem Poverty still lies at the root of the U.S. ‘education crisis.	education
30a9rw	(how access to education determines lives) The terrible loneliness of growing up poor in Robert Putnam’s America	education
1l5ptx	School is a prison — and damaging our kids	education
431l8z	The Man Who Tried to Kill Math in America	education
1r9a64	Good Retention, Poor Assessment... Advice?	education
