9qzyij	Megathread: Likely Explosive Devices Addressed to Former President Obama and Former Secretary Clinton Intercepted by Law Enforcement, Linked to Device Sent to Democratic Donor George Soros	politics
9uj70g	Vote against all Republicans. Every single one.	politics
9va4q5	Democrats received 12 million more votes than Republicans despite losing the Senate.	politics
9uvve1	Discussion Megathread: US Midterm Elections 2018 (Part 5)	politics
9vh04b	Republicans Freak Out as New Ballots Threaten Florida Senate Win	politics
9tyynr	Republicans really want you to think Kavanaugh wasn’t credibly accused of attempted rape	politics
9rp138	Obama: If Republicans really cared about Clinton's emails they would be 'up in arms' over Trump's iPhone	politics
9ur455	29-year-old Alexandria Ocasio-Cortez is poised to become the youngest woman in Congress	politics
9qjces	Obama: 'There's a pattern' of Republicans running the economy 'into the ground' and Democrats having to 'come back and clean things up'	politics
9ug8xe	Noam Chomsky on Midterms: Republican Party Is the “Most Dangerous Organization in Human History”	politics
9ufmtj	Prove it, America. Prove that President Trump is not who we are.	politics
9w02u3	Democrat Harley Rouda wins California U.S. House seat, defeats 15-term Republican Rep. Dana Rohrabacher	politics
9vq83w	Mail-in ballots found sitting in Miami distribution center	politics
9vkr7d	Gillum responds to Scott lawsuit: ‘Counting votes isn’t partisan — it’s democracy’	politics
9s7qss	Jewish leaders tell Trump he's not welcome in Pittsburgh until he denounces white nationalism	politics
9ucd9k	Republican Ana Navarro Calls Trump 'Racist Pig' on CNN, Will Vote for Democrat Andrew Gillum	politics
9vxlcm	Andrew Gillum withdraws concession as Florida recount begins	politics
9ttbm3	Republican: Vote Democrat, hold Donald Trump accountable	politics
9vvm6x	Lindsey Graham says Democrats’ push to count all votes is proof they want to ‘steal’ the election	politics
9unf4i	Discussion Megathread: US Midterm Elections 2018 (Part 1)	politics
9ukncg	An Armed Extremist Group in Georgia Is Threatening Violence If Stacey Abrams Wins	politics
9lz2qd	Megathread: Brett Kavanaugh confirmed to the Supreme Court by Senate 50-48	politics
9v3sp9	Pelosi calls on acting AG to recuse himself from Russia probe	politics
9tv2y7	To be clear: Seeking asylum at the border is not illegal	politics
9uywzt	Tapper: If Trump thinks media is annoying, 'wait till he meets a Democratic House' with subpoena power	politics
9tncla	Obama: Why Are Folks Who Won the Last Election 'So Mad All The Time?'	politics
9u2nzb	More than 4.5 million people vote early in Texas	politics
9u8xme	Obama says Republicans have 'racked up enough indictments to field a football team'	politics
9uqyo8	Discussion Megathread: US Midterm Elections 2018 (Part 2)	politics
9sz0sb	I'm pro-life and I voted for Beto O'Rourke because I'm done being used by the GOP	politics
9un69k	Federal Judge Allows North Dakota Republicans to Block Native Americans From Voting	politics
9uyo4k	Dana Rohrabacher, Putin’s Favorite Congressman, Loses his Seat to Democrat Harley Rouda	politics
9v0q5b	Dems plan to bring in Mueller for televised hearings if Trump fires him	politics
9ucyr2	If the Republicans Win Tuesday, the Reason Will Be Simple: They Cheated	politics
9vki0f	Half of white women continue to vote Republican. What's wrong with them?	politics
9tiy2w	The GOP has become the party of fake news and paranoid fantasies	politics
9tb8yb	Alleged Mueller accuser fails to show up at press conference	politics
9v623y	Republicans won 50.3 percent of NC’s votes for Congress. They took 10 of 13 seats.	politics
9tokgn	Undercover Video Catches Rep. Beto O’Rourke’s Staffers… Helping The Poor	politics
9tlfjv	State Rep’s Outline For Killing Non-Believers In Holy War Is Referred To FBI	politics
9vtl5n	Barack Obama Crushed Donald Trump in the Midterms With Endorsements Winning Far More Races	politics
9v8zmu	'Coward' Lindsey Graham Called Out For Empty Vow To Unleash 'Holy Hell' On Trump	politics
9v0wa8	Scott Walker was narrowly ousted in Wisconsin, and a law he put in place means he can't ask for a recount	politics
9r2tth	America has a right-wing terrorism problem	politics
9uzdh1	Make No Mistake, the Midterms Were a Democratic Victory and a Rebuke of Trump	politics
9qqkys	In Leaked Audio, Brian Kemp Expresses Concern Over Georgians Exercising Their Right to Vote	politics
9osr5g	Report: If Not for Republican Policies, the Federal Government Would Be Running a Surplus	politics
9vju2d	Nancy Pelosi plans to push for revival of climate change committee in new Congress	politics
9oqzik	Republicans Are Outraged about the Deficit They Caused	politics
9usime	Georgia voters wait hours after county mistakenly installs only three machines at polling site	politics
9ttww2	Ahead of Midterms, 'Rigged' Exposes GOP's 10-Year Effort To Sabotage Democracy by Undermining Voting Rights	politics
9q2x9v	Midterms: Poorest states have Republican legislatures, and richest have Democratic ones	politics
9vw18h	Democrats Should Remember Al Gore Won Florida in 2000 — But Lost the Presidency With a Preemptive Surrender	politics
9s3q17	Texas Voting Machines Are Reportedly Switching Votes for Beto O’Rourke to Ted Cruz	politics
9unwz8	Republican lawmaker admits writing ‘death to gays’ manifesto	politics
9u9m1m	Beto O'Rourke on Texas' early voting turnout: 'If this continues, we win'	politics
9uq4c3	Joe Biden 'Guarantees' Donald Trump Will 'Challenge the Legitimacy' Of The Midterm Elections If GOP Loses	politics
9s2mzd	Trump Lies About Sept. 11 to Justify Holding Campaign Rally After Synagogue Shooting	politics
9jcub5	Discussion Megathread: Brett Kavanaugh Senate Hearing	politics
9r8pa8	Twitter Explodes After ‘Gaslighter’ Sarah Sanders Accuses CNN Of Dividing America	politics
9t8j7e	Steve King Loses National GOP Support and More Corporate Donors Over Endorsing White Supremacist	politics
9r9ly4	We recommend Beto O'Rourke for U.S. Senate	politics
9tkaiv	Cop killer in Trump video was released by Sheriff Joe | Longest-serving Republican congressman behind in poll	politics
9uecv1	Voters wait hours in North Miami, and there weren’t enough ballots for everyone	politics
9vu2hr	Senate Democrats consider legal action against Trump's Whitaker appointment	politics
9t8rx8	NRA Tweets anti-Semitic Meme That Top Republican Congressman Previously Deleted	politics
9rxbyv	Reports: Votes in Texas, Georgia are being changed at polls	politics
9uw110	Trump will awaken to unfriendly Congress, and House Dems poised to investigate	politics
9llx7v	Discussion Megathread: Senate Vote On Brett Kavanaugh Confirmation	politics
9vm05t	Three days later: Hey, Republicans really did get clobbered	politics
9rv002	F-Bombs and Real Bombs: Our problem isn’t “incivility.” It’s right-wing violence.	politics
9r2avt	NAACP: Georgia votes for Democrat Stacey Abrams are being changed to Republican Brian Kemp	politics
9r196i	Ted Cruz decries ‘incivility’ hours after calling for extrajudicial imprisonment of Democrats	politics
9pk8vt	The President of the United States Just Explicitly Endorsed Political Violence	politics
9v42yv	Sanders Warns Trump: Interfering with Mueller Probe an 'Impeachable Offense'	politics
9nbnp2	Republicans may be about to steal an election in Georgia	politics
9rqp0k	After arrest, Republicans struggle with mail bombs fallout	politics
9vjzsi	Lindsey Graham in 2017: ‘Holy hell to pay’ if Sessions is fired. In 2018: ‘When was that? What year?’	politics
9u763d	Brian Kemp Just Engaged in a Last-Minute Act of Banana-Republic Level Voter Manipulation in Georgia	politics
9qe7i6	To hell with civility: Enough with the pity party for Mitch McConnell, please	politics
9tehu5	The convicted cop-murderer featured in a Trump ad came to U.S. under Bush and used AR-15 Republicans refuse to ban	politics
9tq953	Twitter Removed 10,000 Bots Pretending to Be Democrats Telling Other Democrats Not to Vote	politics
9vxgsq	Republican dubbed 'Russia's favorite congressman' loses seat after 30 years	politics
9v9lpb	Dem wins House seat after Republican claims premature victory	politics
9u4no4	I served under President Bush: I left the GOP to vote Dem. Trump is a fascist, a danger to our republic	politics
9plwns	Analysis: Brian Kemp has purged over 300,000 voters from Georgia rolls	politics
9v09kc	Voter suppression really may have made the difference for Republicans in Georgia	politics
9uj3wh	Trump’s “Incredible” Foxconn Deal Turns Out to Be a Another Massive Con Job	politics
9pjqry	107,000 purged from Georgia voter rolls for not voting in past elections	politics
9v4xuw	'It is imperative’ that Mueller probe continue unimpeded, says Mitt Romney	politics
9v1z3n	People Who Accept Climate Change Now Control the House Science Committee	politics
9qnxyr	Conservative Lawmakers Are Attempting to Steal the Votes of Thousands of Native Americans	politics
9sttsn	Facebook is banning far-right militia The Proud Boys after a violent attack in New York	politics
9rmilg	Texans say voting machines changing straight-ticket choices	politics
9jfa9a	Discussion Megathread: Brett Kavanaugh Senate Hearing (Thread 2)	politics
9moqzw	Republicans Threaten Lawsuit After Bar Declines to Host Pro-Kavanaugh ‘Beers 4 Brett’ Party	politics
9vnhei	Trump is Trapped, and Trying to Protect Himself at All Costs	politics
9sz0yy	Not one elected Republican was willing to meet with President Trump in Pittsburgh	politics
9px9lh	Audio Surfaces of Republican Rep. Jason Lewis Mocking Sexual Harassment Victim	politics
9j3w3i	Megathread: Michael Avenatti releases affidavit from woman detailing new allegations against Brett Kavanaugh	politics
9v3ii2	Trump says government will halt if Dems investigate him	politics
9rkzgw	As a Democrat, I now fear for my safety. As an American, I weep for my country. This is not a healthy democracy anymore	politics
9ninfi	Republicans Have a Secret Weapon in the Midterms: Massive Voter Suppression	politics
9p7nzu	Wilbur Ross Lied to Congress About the GOP’s Plot to Rig the Census. This Should Be a National Scandal.	politics
9nwe2d	Republicans get busted posing as communists, trying to donate to Democratic campaign	politics
9uqrb7	Trump has the worst approval rating of any president in modern US history heading into their first midterm election	politics
9t0b9q	2nd woman says she was offered money to talk about past encounters with Mueller in apparent hoax	politics
9u2wql	Trump Keeps Lying About Having Started His Wall, And His Supporters Don't Care	politics
9vpqh1	Sinema widens lead over McSally in Arizona Senate race	politics
9o87ob	Donald Trump finally just said it: he doesn’t care if Kavanaugh’s accuser is telling the truth	politics
9vr8eu	Georgia Vote Shows Signs of Tampering, Civil Rights Group Says	politics
9t9et5	Beto O'Rourke Boost: Texas Youth Vote Soars 500 Percent Ahead Of Midterm Election Against Ted Cruz	politics
9p3m0a	Rod Rosenstein says the Russia probe has uncovered a widespread Russian effort to meddle in the 2016 race	politics
9vxjx6	Florida Republicans Are Upset That All the Votes Have to Be Counted	politics
9jo5k2	Discussion Megathread: Committee Vote on Brett Kavanaugh Nomination	politics
9rz97v	Georgia’s Kemp Purged 340,134 Voters, Falsely Asserting They Had Moved	politics
9pvh78	GOP Removes Sole Polling Place From Famous Hispanic Majority City in Kansas	politics
9r509v	Black Voters in Georgia Say Something Funny Is Going on With Their Voting Machines	politics
9vlcdl	Democrats could win 40 House seats, the most since Watergate	politics
9td95y	Trump May Finally Be Getting Too Racist for America	politics
9uyn6f	Democratic 'blue wave' makes landfall in Texas House, flipping 11 red seats across the state	politics
9u36gv	Jimmy Buffett decries an “insane two years,” urges Floridians to vote for Andrew Gillum and Bill Nelson	politics
9opg4u	McConnell eyes cuts to Medicare, Social Security to address deficit	politics
9vk22h	55,000 of my neighbors voted for a neo-Nazi	politics
9o5vg8	Trump-supporting "Proud Boys" group will be investigated by New York hate crimes unit after violence in Manhattan	politics
9og7al	99.7 Percent of Unique FCC Comments Favored Net Neutrality	politics
9vzhbp	Beto O’Rourke helped turn Texas courts blue	politics
9vl4nb	Scarborough: GOP trying to stop vote count in Florida is ‘third-world country stuff’	politics
9t5e9b	The First Thing Democrats Will Do If They Win The House Is Pass Anti-Corruption And Voting Rights Reforms	politics
9tu84z	Noam Chomsky Calls Trump and Republican Allies "Criminally Insane"	politics
9vu09e	Sen. Jeff Flake: 'Somebody needs to run' against Trump in 2020 GOP primary	politics
9s8rf7	However the Midterms Go, the Republican Party Is Going to Get More Extreme	politics
9ve0v8	Flake to try to force vote on bill protecting Mueller	politics
9vyt6a	Reminder: Democrats Can Now Get Their Hands on Trump’s Taxes	politics
9uouly	Taylor Swift says people shouldn't underestimate young voters, urges fans to vote	politics
9lvtdn	Senators representing less than half the U.S. are about to confirm a nominee opposed by most Americans	politics
9qt433	Ted Cruz says Beto O'Rourke can have 'double occupancy cell with Hillary Clinton' after supporter chants 'Lock him up'	politics
9s531e	No, Republicans are not the party of pre-existing condition protection. Never have been.	politics
9vtv1k	Investigations are coming: Democrats will make government ethics the priority for 2019	politics
9ob218	Texas Purges Thousands Of Voters To Help Ted Cruz Win Re-Election	politics
9w0r6v	Trump appears distracted and disengaged on Paris trip	politics
9sd2gm	Calling on Brian Kemp to Resign, Jimmy Carter Says Being a Candidate While Also Controlling Election Process Violates 'Most Fundamental Principle' of Democracy	politics
9rt420	Pipe bomb suspect Cesar Sayoc is a registered Republican and a Trump fan with a criminal record	politics
9u017a	Capt. Sullenberger: Vote against Republican control	politics
9vkzwc	Rick Scott sues election officials, claiming counting all votes equals ‘rampant fraud’	politics
9oi689	At Least 90,000 Voters Purged From Nevada Voter Rolls, Voting Rights Group Claims	politics
9ox9f3	Mueller Ready to Deliver Key Findings in His Trump Probe, Sources Say	politics
9jhjgw	Discussion Megathread: Brett Kavanaugh Post-Hearing Thread	politics
9v32dc	Schumer: Interfering with Mueller would spark 'constitutional crisis'	politics
9ie49l	Megathread: Additional accusations of sexual misconduct made against Brett Kavanaugh	politics
9oz9mr	Vermont hits record 92.5 percent voter registration ahead of election	politics
9r1fwz	White House Official Admits Trump Is Lying About Caravan to Manipulate His Voters	politics
9taxor	The Republican behind North Carolina’s bathroom law invested in a neo-Nazi social media site	politics
9vauid	Kemp Resigns As Georgia’s Secretary Of State	politics
9uvl0o	Kris Kobach Loses Kansas Governor's Race To Democrat Laura Kelly	politics
9uvrit	NBC News: Democrats win control of the House of Representatives	politics
9t9prm	CNN’s Don Lemon doubles down after saying white men are ‘the biggest terror threat in this country’	politics
9ui0jj	Republicans will nuke our health care system if they aren’t crushed at the polls	politics
9jq4vl	Senate GOP agrees to one-week delay on Kavanaugh confirmation to allow for FBI probe	politics
9t0s6t	Trump admin will apparently not renew program to fight domestic terror	politics
9ma1b6	Taylor Swift breaks silence on politics, supports Democrats in Tennessee races	politics
9ud5i7	Florida Could Restore Voting Rights to 1.5 Million Convicted Felons on Tuesday	politics
9qdiz3	Leaked Trump Administration Memo: Keep Public in Dark About How Endangered Species Decisions Are Made	politics
9rbgp6	Mitch McConnell says it out loud: Republicans are gunning for Social Security, Medicare and Obamacare next	politics
9tki9w	Viral photo showing Mexican police being dragged is from 2014, not the migrant caravan	politics
9sqi45	Mueller's office asks FBI to investigate claims that women were offered money to falsely accuse Mueller of sexual misconduct	politics
9jjo7o	American Bar Association: Delay Kavanaugh until FBI investigates assault allegations	politics
9n4mzq	Morning Consult poll: Bernie Sanders is most popular senator, Mitch McConnell is least popular	politics
9lb5ky	‘Unfathomable’: More than 1,200 law professors sign letter opposing Kavanaugh’s confirmation	politics
9v10h7	Fox News barely mentions caravan first morning after midterms	politics
9lvdq1	Christine Blasey Ford’s Attorneys Reveal Statement From Corroborating Witness	politics
9vnzoa	Rick Scott’s Allegations of Election Fraud Are Inexcusable	politics
9kfssy	Outrage Grows As Omissions From Kavanaugh Probe Become Apparent	politics
9s44wz	Trump loved celebrating the stock market surge in 2017, but he's been quiet about this year's declines	politics
9loy3w	Activists Pledge $1.9 Million to Susan Collins’s Democratic Challenger If She Votes to Confirm Brett Kavanaugh	politics
9mjx9b	Tennessee, nationwide voting registrations spike after Taylor Swift gets political on Instagram	politics
9uv7df	Florida gives more than 1 million people their voting rights back	politics
9udh2i	Voting machine errors already roil Texas and Georgia races	politics
9p88ch	U.S. Knew of Saudi Plan to Seize Missing Journalist, Post Says	politics
9r25bp	Right-Wing Commentators Have Already Decided the Explosive Packages Are a False Flag	politics
9n28bf	Brian Kemp Is Blocking 53K Applicants From Registering To Vote, Most Of Them Black	politics
9qzdlf	The Anti-Vaxxer Disease Is Now a Republican Epidemic	politics
9upnbe	Voters in South Carolina say voting machines changed their choices	politics
9o4vrn	Al Gore calls Trump’s deregulation proposals ‘literally insane’	politics
9uvgg3	We waited almost 5 hours to vote in my Georgia precinct. How convenient for Kemp.	politics
9ll8kh	GOP nervous ahead of Kavanaugh vote: “We don’t have 50 right now”	politics
9uwj6g	Democrats win majority in New York's Senate, ending GOP control	politics
9ugbxo	Robert Reich: Every Single Republican Must Go	politics
9m779u	Why I’m Leaving the Republican Party	politics
9vpa5c	Trump loyalist Matthew Whitaker was privately counseling the White House on investigations	politics
9w3egf	Nancy Pelosi: Mueller Doesn’t Have to Indict Trump for Congress to Impeach Him	politics
9uyyc4	Brian Kemp's Victory in Georgia Needs an Asterisk	politics
9vldgq	Republicans claim bill protecting Mueller is unconstitutional. A constitutional scholar explains why they're wrong.	politics
9lmw6t	Murkowski Votes No On Procedural Vote For Kavanaugh	politics
9pd7o4	Beto O'Rourke says Ted Cruz has second-worst bipartisanship record of all senators in 25 years	politics
9lpl8t	Susan Collins Supports Kavanaugh, Putting Him in Reach of Supreme Court	politics
9r8hjv	Republicans are rigging elections to win. They're anti-voter and anti-democracy.	politics
9p9l32	America Already Has a Centrist Party. It’s Called the Democrats.	politics
9tphpm	“We Are At A Turning Point”: Counterterrorism Experts Say Trump Is Inspiring A Terrifying New Era Of Right-Wing Violence	politics
9qe7lh	Trump privately ready to blame Ryan and McConnell if Republicans lose midterms	politics
9nxo6k	A black Republican found he couldn't defend the GOP any more over accusation of Georgia voter suppression	politics
9ukhqp	Joint Chiefs chair says soldiers will not be involved in denying border entry to migrants	politics
9ucowe	Democrat McCaskill holds narrow lead over Republican Hawley in key Missouri Senate race: NBC News/Marist poll	politics
9tbkgy	Vote for Claire McCaskill, You Liberal Dipshits	politics
9mi25y	It’s official: Americans are living under the rule of a minority	politics
9uc7wr	Vote, vote, vote: One of the best reasons for Democrats to turn out is because Republicans don't want them to	politics
9r22k7	Republicans Hate You	politics
9vxhvl	Educated Americans are leaving the GOP to vote for Democrats, analysis of midterms shows	politics
9udp95	What this election is really about: Tax-cut-addicted Republicans are poised to slash Social Security and Medicare; Dems must rise to defend them	politics
9jidgl	Brett Kavanaugh’s Testimony Made It Easier Than Ever to Picture Him As an Aggressive, Entitled Teen	politics
9t9uqw	5,000 . . . 15,000 . . . Do I hear 25,000 troops for a useless border exercise?	politics
9uox7i	"Dónde votar" ("where to vote" in Spanish) is the top trending Google search today	politics
9uf80q	Flag stomping image is from a 2016 student protest in Wisconsin, not migrant caravan	politics
9ua4a8	'Trump has hijacked the election': House Republicans in panic mode	politics
9jn7xy	Sexual Assault Survivor Confronts Jeff Flake On CNN: ‘Don’t Look Away From Me’	politics
9ug0q4	Democrats see late surge in Senate battlegrounds	politics
9lc8m8	I Lived With Brett Kavanaugh At Yale. The FBI Never Returned My Call.	politics
9uhw17	I’ll Never Forget Brett Kavanaugh’s Anger	politics
9k8wd5	55% of GOP Say Sexual Assault Not Disqualifying for SCOTUS; What Is *Wrong* With Them?	politics
9jlan4	A Republican Yale drinking buddy of Kavanaugh's tells CNN he lied to the Senate Judiciary Committee	politics
9muahp	Trump Administration Seeks to Stifle Protests Near White House and on National Mall	politics
9t4fuw	Don't vote for our 'homophobic' and 'racist' dad, Missouri candidate's kids tell voters	politics
9na1xz	It Seems Bad That the Guy Running for Governor in Georgia Is Also In Charge of Who Gets to Vote in Georgia	politics
9p17il	Up to 9.5 million net neutrality comments were made with stolen identities	politics
9lqnlf	Nunes buried evidence on Russian meddling to protect Trump. I know because I’m on the committee	politics
9vzbrp	Kyrsten Sinema again extends lead over Martha McSally in Senate race	politics
9upq4x	36 Million in U.S. Cast Early Votes, Shattering Records for Young People & People of Color	politics
9pxve2	McConnell confronted at restaurant, asked to "leave the entire country"	politics
9qi5ex	Obama: When You Hear Economy's Improving 'Remember Who Started It'	politics
9pi20v	Trump Got Elected Bashing Sharia Law. Now He’s in Bed With Its Lethal Champion.	politics
9lwbwi	Brett Kavanaugh Will be Fourth Supreme Court Justice Nominated by President who Didn't win the Popular Vote	politics
9goyuy	Megathread: Senate Judiciary Committee To Hold Public Hearing On Kavanaugh Accusations, Vote Postponed	politics
9uf0hj	Dave Brat could be the first Republican to lose Virginia’s 7th district in a half-century	politics
9gwx38	Ted Cruz leads Beto O'Rourke 54 to 45, Quinnipiac poll says	politics
9jfeao	Lindsey Graham Threatens to Falsify Accusations of Assault Against Democratic Supreme Court Nominees	politics
9ucsu6	Their Soybeans Piling Up, Farmers Hope Trade War Ends Before Beans Rot	politics
9rbyut	‘Maga bomber’ trends on Twitter after string of bomb scares	politics
9sfd8o	Religious Leader Interrupts Jeff Sessions Speech: ‘I Call Upon You to Repent’	politics
9ov3ux	Ted Cruz snaps at debate moderator when asked about civility: "Don’t interrupt me, Jason"	politics
9uvy3x	With House majority, Dems intend to request for Trump's tax returns	politics
9q4hej	The Trump administration reportedly wants the government to revoke civil rights protections from transgender people	politics
9ivipc	President Trump Is Literally the Laughingstock of the World	politics
9gdw1p	Are Republicans Really Going to Nominate an Accused Rapist to Overturn Roe?	politics
9ldcw6	The "Fix Is In, Folks": Though She Admits Not Fully Reading It, Susan Collins Describes FBI Probe as "Very Thorough"	politics
9lhj6q	We were Brett Kavanaugh’s drinking buddies. We don’t think he should be confirmed.	politics
