9f89yp	Scientists discover optimal magnetic fields for suppressing instabilities in tokamak fusion plasmas, to potentially create a virtually inexhaustible supply of power to generate electricity in what may be called a “star in a jar,” as reported in Nature Physics.	science
9t70zk	"Schrödinger's Bacterium" Could Be a Quantum Biology Milestone - A recent experiment may have placed living organisms in a state of quantum entanglement	science
960gx6	Researchers have found a way to accelerate antimatter in a 1000x smaller space than current accelerators. What is now only possible by using large physics facilities at tens of million-dollar costs could soon be possible in ordinary physics labs.	science
9q2hrt	Physicists are working on memristors, resistors with a memory, made from niobium-doped strontium titanate, which mimic how neurons work. Their results were published in the Journal of Applied Physics.	science
9d540y	The “chicken or egg” paradox was first proposed to describe the problem of determining cause-and-effect. Now, physicists show that, as far as quantum physics is concerned, the chicken and the egg can both come first. This is called `indefinite causal order’, as reported in Physical Review Letters.	science
9btcop	Physics theory used to predict crowd behavior - Researchers developed a highly accurate mathematical approach to predict the behavior of crowds of living creatures, using Nobel Prize-winning methods originally developed to study large collections of quantum mechanically interacting electrons.	science
9kqdbo	2018 Nobel Prize in Physics Discussion Thread	science
9pgp1e	What the electron’s near-perfect roundness means for new physics	science
9hecs5	Quantum jumps, when an electron absorbs a photon and "jumps" into another state, were regarded as instantaneous. Scientists have for the first time measured the duration of this 'photoelectric effect', first described by Einstein, in the attosecond range, a billionth of a billionth of a second.	science
8tcnqn	Team finds hidden state of matter in superconductive alloy - Using the physics equivalent of strobe photography, researchers have used ultrafast spectroscopy to visualize electrons interacting as a hidden state of matter in a superconductive alloy.	science
9fynwv	Princeton researchers discover new quantum state of matter that can be "tuned" at will; it's 10 times more tuneable than existing theories can explain => enormous possibilities for next-generation nanotechnologies and quantum computing	science
9gnj49	Bizarre Physics Phenomenon Suggests Objects Can Be Two Temperatures at Once [DOI: https://www.nature.com/articles/s41467-018-04536-7]	science
9frsly	Turns out (most) colours we see in pictures of the Northern Lights wouldn't be seen by the naked eye. Took the time to write a Post about it with the biology and physics of it simply resumed, after encountering them in Eastern Iceland.	science
9pfgqg	Binary Giant Black Holes Spotted at Galaxy's Core	science
9opvzi	Hacker attacks on everything from social media accounts to government files could be largely prevented by the advent of quantum communication, which would use particles of light called "photons" to secure information rather than a crackable code	science
9eobi1	Scientists have developed a photoelectrode that can harvest 85 percent of visible light in a 30 nanometers-thin semiconductor layer between gold layers, converting light energy 11 times more efficiently than previous methods	science
99x94v	A new quantum experiment breaks the idea of "before" and "after." Physicists from the University of Queensland designed a race course for light that forced a single particle to traverse two pathways at once, making it impossible to say in which order it completed a pair of operations.	science
89kv6f	Summary: Physicists have identified a new state of matter whose structural order operates by rules more aligned with quantum mechanics than standard thermodynamic theory.	science
90i6jw	The Octonion Math That Could Underpin Physics	science
9o2ke8	Solar Wind Signatures Throughout the High‐Latitude Atmosphere - Francia - 2018 - Journal of Geophysical Research: Space Physics	science
9gl300	Honeybees in resting swarms respond to physical disturbances by changing the shape of the whole swarm, even if doing so comes at an individual cost, reports a paper published online this week in Nature Physics.	science
96666v	PhD student develops spinning heat shield for future spacecraft - This design is the first in the world to utilise centrifugal forces that stiffen lightweight materials to prevent burnup.	science
9gxusm	Bizarre Physics Phenomenon Suggests Objects Can Be Two Temperatures at Once	science
94vexh	A study found even after lobectomy a child's brain rewires to compensate for the lost parts.What the researchers witnessed was the left hemisphere assuming the functions usually performed by the missing regions of his brain.	science
98wafc	Light from ancient quasars helps confirm quantum entanglement: Results are among the strongest evidence yet for “spooky action at a distance”	science
9ffk6p	An international team of researchers led by Princeton physicist Zahid Hasan has discovered a quantum state of matter that can be "tuned" at will—and it's 10 times more tuneable than existing theories can explain	science
7fuhq9	Physicists from MIT designed a pocket-sized cosmic ray muon detector that costs just $100 to make using common electrical parts, and when turned on, lights up and counts each time a muon passes through. The design is published in the American Journal of Physics.	science
7abb2q	A mystery void was discovered in the Great Pyramid of Giza, one of the Seven Wonders of the World, using particle physics. Muon imaging revealed the structure, the first such find in over a century.	science
9bjjqd	Long-sought decay of Higgs boson observed	science
9epbku	For every one-degree-Celsius increase in temperature, mountaintop species shift upslope 100 meters, shrinking their inhabited area and resulting in dramatic population declines, according to new research.	science
9dvnt7	History suggests impacts of global warming are being underestimated - New analysis of an episode of historic climate change 56 million years ago may provide impacts on the possible effects rising temperatures on Earth as a result of human-caused global warming.	science
960201	Dark matter not at the core of neutron stars: Possibility that neutrons decay into dark matter particles is incompatible with astrophysical observations	science
7kwv02	U.S. and European physicists searching for an explanation for high-temperature superconductivity were surprised when their theoretical model pointed to the existence of a never-before-seen material in a different realm of physics: topological quantum materials	science
93jd0t	The Peculiar Math That Could Underlie the Laws of Nature	science
6wtiwg	Scientists broke the record for coldest temperature of molecules at 50 millionths of a degree above absolute zero, as reported in Nature Physics.	science
8ie5ho	On November 30th, 2016, more than 100,000 people around the world contributed to a first-of-a-kind quantum physics experiment known as The Big Bell Test, to close the so-called “freedom-of-choice loophole” in tests of Einstein’s principle of local realism, as reported in this week’s Nature.	science
6qgxwz	New Theory Suggests Life Wasn't a Fluke of Biology, but Physics: an inevitable outcome of thermodynamics. Groups of atoms will naturally restructure themselves so as to burn more and more energy, facilitating the incessant dispersal of energy and the rise of “entropy” or disorder in the universe.	science
99otnx	A Milestone for Forecasting Earthquake Hazards - Researchers Replicate Latest California Earthquake Projections with Physics-based Model	science
8yml0l	In a new study, males were more likely to endorse sexually aggressive behavior if they worried they were viewed as incompetent.	science
7h91dg	Tailgating won’t get you through that intersection any faster - there’s a time lag before you can safely accelerate your car in a solid jam, offsetting any advantage of closeness, researchers reported last week in the New Journal of Physics.	science
97xct3	21st-century modeled permafrost carbon emissions accelerated by abrupt thaw beneath lakes	science
8g7wbn	Science AMA Series: I'm Adam Becker, astrophysicist and author of WHAT IS REAL?, the story of the unfinished quest for the meaning of quantum physics. AMA!	science
8ra7z9	New type of photosynthesis discovered	science
8ggn8n	Professor Stephen Hawking's final research paper suggests that our Universe may be one of many similar to our own.	science
8el3o5	People with a long-term interest in science tend to trust scientific authorities like NASA and the IPCC when it comes to climate, regardless of what their political persuasions may be. It's the latest result that indicates that a "scientific curiosity" can get people past their ideology.	science
880tr6	Science AMA Series: Hi Reddit, we're a group of passionate medical physicists working in clinical, industry and research, here to shed light on the wonderful world of medical physics. Ask us anything!	science
8wci24	Einstein proven right for the 3rd time in just a few weeks. In the new study, astronomers tested the Equivalence Principle, which says objects of different masses (such as a feather and a bowling ball) should fall at the same rate. But this time, they tested it with a pulsar and a white dwarf.	science
76y7z6	Science AMA: We are the first people to observe neutron stars colliding that the LIGO team detected, we're the Swope Discovery Team, ask us anything about supernovas, astrophysics, and, of course, neutron star collisions, AMA!	science
6isyum	American Geophysical Union AMA: Hi Reddit, I'm Piers Forster, I am here to talk about what caused past global warming and what will happen in the future. I am currently Chair of Climate Physics and Director of the Priestley International Centre for Climate, University of Leeds, UK. Ask Me Anything!	science
7qj95q	Science AMA Series: I'm Steven Strogatz, a professor of mathematics at Cornell University in Ithaca, New York. I apply math to biology and physics and love communicating with the public about math through books, radio shows, and New York Times articles, and I’m here today to talk about it. AMA!	science
8in67c	Science AMA Series: I’m Tony Hey, chief data scientist at the UK STFC. I worked with Richard Feynman and edited a book about Feynman and computing. Let’s talk about Feynman on what would have been his 100th birthday. AMA!	science
7x39w2	First high-precision measurement of the mass of the W boson at the LHC - The reported result gives a value of 80370±19 MeV for the W mass, which is consistent with the expectation from the Standard Model of Particle Physics	science
8u2fou	Researchers more than doubled the ability of a material to convert heat into electricity, which could help reduce the amount of wasted heat, and thus wasted fossil fuel, in daily activities and industries.	science
8in1o2	Particle Physics Resurrects Alexander Graham Bell’s Voice	science
88hyd7	Venus' Spectral Signatures and the Potential for Life in the Clouds: Scientists found that the observed UV contrasts of Venus change in episodic ways that are similar to large phytoplankton blooms on Earth’s oceans, suggesting that Venus' lower clouds may potentially harbor microorganisms.	science
8u0lck	Topical issue of Solar Physics completed and published	science
95atca	Explosive facelift left star looking much younger than its true age	science
8v601y	The Math of Causation Puzzle Solution | Quanta Magazine	science
7svlyh	Science AMA Series: I’m Charles Day, the editor-in- chief of Physics Today magazine and a former X-ray astronomer. AMA!	science
8hffnz	Physics-based simulations of aerial attacks by peregrine falcons reveal that stooping at high speed maximizes catch success against agile prey	science
7vxtzp	Intense laser experiments provide first evidence that light can stop electrons: By hitting electrons with an ultra-intense laser, researchers have revealed dynamics that go beyond 'classical' physics and hint at quantum effects.	science
7oz0fa	Two Experiments Show Fourth Spatial Dimension Effect	science
5kwock	Science AMA Series: We're scientists on a boat in the Southern Ocean (Antarctic Ocean) studying climate change, ocean physics and marine biology, Ask Us Anything!	science
8irlrg	APS Physics Synopsis: Revised Prediction for Mercury’s Orbit - Mercury’s orbital ellipse is predicted to shift an additional 1∘ every two billion years as a result of previously unaccounted for effects of general relativity	science
8l1rc6	Physicists See Quantum Effects in Photosynthesis	science
8j83ad	New Multiverse Research Suggests Scientists Need a New Law of Dark Energy	science
6aqi3q	Science AMA Series: We’re Jorge Cham (creator of PhD Comics & PhD in Robotics) & Daniel Whiteson (particle physicist & CERN researcher). We wrote a book called WE HAVE NO IDEA about the biggest unanswered questions in the Universe! Ask us anything!	science
884i9c	Based on an extensive collection of lunar and terrestrial samples, researchers have determined that most of the water on Earth was already present at the time of the impact that created the moon.	science
6mlpo6	ACS AMA: Hi Reddit! I am Danielle Buckley, a physical chemist and STEM education professional. Ask me anything about quantum dots or alternative career paths in science!	science
880agp	Optoelectronic engineers manufactured special type of LCD that is paper-thin, flexible, light and tough. A daily newspaper could be uploaded onto a flexible paperlike display that could be updated as fast as news cycles, that will be cheap to produce, perhaps only costing $5 for a 5-inch screen.	science
6qhgsn	Science AMA Series: I'm Assa Auerbach, Professor of Physics at Technion. I wrote a graphic novel for the broad public, explaining the important concepts of Entropy and the Second Law of Thermodynamics through the adventures of Maxwell's Demon. I’m here today to talk about it. AMA!	science
79uz19	Science AMA Series: I am Dr Sarah Malik, a dark matter researcher in Imperial College London’s High Energy Physics Group. My current research is using the Large Hadron Collider at CERN to searching for particles that make up 'dark matter’. AMA!	science
7o7kdj	New research shows that physics labs are terrible at educating students.	science
7zw3j0	Prevention is better than cure: targeted vaccination to halt epidemics is nearly always more effective than either doing nothing or attempting to contain an outbreak through quarantine, finds physics-based simulations on networks which replicates the real world, as reported in Physical Review E.	science
7yvd3o	Science AMA Series: I'm Marty Ralph, research meteorologist at Scripps Institution of Oceanography. My research focuses on extreme weather events including atmospheric rivers. This winter, we're flying Hurricane Hunter aircraft through storms. AMA!	science
87a9fw	AUTOMAP, a new artificial intelligence technique developed at Massachusetts General Hospital and the Harvard Physics Department dramatically improves the quality of medical imaging and could pave the future for computer-aided clinical scanning	science
802j8p	Improved Hubble Yardstick Gives Fresh Evidence for New Physics in the Universe	science
4o4jz3	Study shows that cats understand the principle of cause and effect as well as some elements of physics. Combining these abilities with their keen sense of hearing, they can predict where possible prey hides.	science
6jicr3	Researchers have found a way around what was considered a fundamental limitation of physics for over 100 years. They discovered that more electromagnetic energy can be stored in wave-guiding systems than previously thought. The discovery has implications in telecommunications.	science
7sp0zi	Better than a hologram: Engineers create a system that projects 3D images that float in the air. Holograms are just 2D projected images.	science
6e89h6	Science AMA Series: I'm Joss Bland-Hawthorn, ARC Laureate Fellow Professor of Physics and Director of the Sydney Institute for Astronomy, Sydney, Australia. I specialize in extragalactic and galactic astronomy, and in developing astronomical instrumentation. AMA!	science
3eret9	Science Ama Series: I am Stephen Hawking, theoretical physicist. Join me to talk about making the future of technology more human, reddit. AMA!	science
787899	Science AMA Series: I’m James Owen Weatherall, physicist and philosopher at the University of California, Irvine. I wrote a book about how the concept of nothingness—the absence of stuff—has been central to centuries of physics theories. AMA!	science
46k5y4	Science AMA Series: Hi Reddit, we're scientists at the Max Planck Institute for plasma physics, where the Wendelstein 7-X fusion experiment has just heated its first hydrogen plasma to several million degrees. Ask us anything about our experiment, stellerators and tokamaks, and fusion power!	science
4myirx	40 years ago Stephen Hawking showed information can be lost from the universe when black holes evaporate away. No one has resolved the paradox, which undermines determinism. In a new paper, Hawking points to a potential solution	science
3igf3s	97% of climate science papers support the consensus. What about those that don't? The one thing they seem to have in common is methodological flaws like cherry picking, curve fitting, ignoring inconvenient data, and disregarding known physics.	science
812fho	Physicists build bizarre molecules called ‘Rydberg polarons’: Using lasers, physicists have coaxed ultracold strontium atoms into complex structures unlike any previously seen in nature	science
74uor1	An international team of researchers have developed a highly elastic, protein–based surgical glue that could transform emergency treatments by sealing up critical wounds in 60 seconds, without the need for staples or sutures.	science
84ljtd	Researchers have produced a "human scale" demonstration of a new phase of matter called quadrupole topological insulators that was recently predicted using theoretical physics. These are the first experimental findings to validate this theory.	science
3iuic8	Large Hadron Collider: Subatomic particles have been found that appear to defy the Standard Model of particle physics. The scientists working at CERN have found evidence of leptons decaying at different rates, which could be evidence for non-standard physics.	science
89ouvc	The physics of finance helps solve a century-old mystery	science
7lhz6h	Using ultracold atoms, researchers have found an exotic state of matter where the constituent particles pair up when limited to two dimensions. The findings from the field of quantum physics may hold important clues to intriguing phenomena of superconductivity.	science
5289p0	Time crystals - objects whose structure would repeat periodically, as with an ordinary crystal, but in time rather than in space - may exist after all.	science
3w3v4t	A fundamental quantum physics problem has been proved unsolvable	science
6me8a0	Science AMA Series: Hi Reddit, we’re a team of physicists at the University of Sussex who recently revealed the first ever blueprint for a large-scale quantum computer. Ask us anything!	science
4tev0n	Science AMA Series: We are quantum technology researchers from Switzerland. We’ll be talking about quantum computers, quantum entanglement, quantum foundations, quantum dots, and other quantum stuff. AMA!	science
7tx993	High-resolution grayscale image hidden in a laser beam which provides new opportunities for various applications, including encryption, imaging, optical communications, quantum science and fundamental physics	science
6bo7j8	Scientists Achieve Direct Counterfactual Quantum Communication	science
6pexh4	Bouncing balls on a hot pan led to a new physics discovery: Water droplets float in a hot pan because of the so-called Leidenfrost effect. Now, physicists have discovered a variation: the elastic Leidenfrost effect. It explains why hydrogel balls jump around on a hot plate making high-pitched sounds	science
5xk2xj	Supersolid: Physicists Create New State of Matter | Physics | Sci-News.com	science
714z60	Researchers have discovered a new tri-anion particle, a type of particle with three more electrons than protons. The new particle is extremely stable and its discovery apply to a variety of applications in the fields of physics and chemistry.	science
6wyn7g	Black hole models contradicted by tests at Sandia National Labs—researchers suggest revisions are needed in our interpretations of accretion disk emissions	science
4q2j6z	Experiments confirm that the barium-144 nucleus is pear shaped	science
49yiy8	Science AMA Series: I’m Anthony Aguirre, Professor of Physics at UC Santa Cruz. I’m searching for other universes, trying to understand black holes, bringing funding to not-quite-crazy physics, worrying about superintelligent AI, and crowd-forecasting the future. AMA!	science
7zaxe1	Human Brain Organoids on a Chip Reveal the Physics of Folding	science
4nv9dw	Science AMA Series: I'm Matt O'Dowd, writer & host of PBS Space time and astrophysics professor at City University of New York where I research black holes, quasars, gravitational lensing, and galaxies. AMA!	science
3pw7xy	One of the oddest predictions of quantum theory,that a system can't change while you're watching it, has been confirmed in an experiment by physicists. Their work opens the door to a fundamentally new method to control and manipulate the quantum states of atoms and could lead to new kinds of sensors	science
5nizi5	Researchers have demonstrated the first laser based on an unconventional wave physics phenomenon called bound states in the continuum. The technology could revolutionize the development of surface lasers, making them more compact and energy-efficient for communications and computing applications	science
6lrl7q	Scientists have detected a new particle at the Large Hadron Collider at Cern, with a mass around 3.5 times heavier than protons and neutrons, and has double the electric charge of a proton.	science
425h2k	Quantum knots are real: The very first experimental observations of knots in quantum matter have just been reported in Nature Physics.	science
7l22kd	The CMS Collaboration at CERN has just released over 1 PB (petabyte) of high-level open data recorded in 2012 from collisions at the LHC.	science
6zmbp7	Crystal treated with erbium, an element already found in fluorescent lights and old TVs, allowed researchers to store quantum information successfully for 1.3 seconds, which is 10,000 times longer than what has been accomplished before, putting the quantum internet within reach - Nature Physics.	science
2bqmhp	Mysterious signal from the center of the Perseus Cluster unexplained by known physics	science
435z2u	The variable behavior of two subatomic particles, K and B mesons, appears to be responsible for making the universe move forwards in time.	science
7l9hmv	Scientists discover entirely new material that cannot be explained by classical physics	science
6djxwq	Physicists directly observe Hydrogen bonds in single molecule...	science
6s0qa4	Scientists Prove Decades-Old Physics Theory That May Illuminate Dark Matter	science
7jrv6d	Study details the physics of a café latte: Layering in café lattes yields insights for engineering, medicine, and environment	science
4g39d9	Science AMA Series: I'm Christophe Galfard, a theoretical physicist and author of The Universe In Your Hand. I write and speak about the science of the universe, from black holes to our cosmic origins and nearly everything in between. AMA!	science
4luu10	American Chemical Society AMA: I am Steve Maguire, a chemist working at SNOLAB in Sudbury, ON, hunting for neutrinos. I’m also avid about science outreach. Ask me anything about hunting for neutrinos or communicating science.	science
48zsd7	Because Quantum Mechanics Is So Counter-intuitive, Researchers have written a Computer Program to Choose Quantum Experiments	science
2fjzdk	Mother of Higgs boson found in superconductors: A weird theoretical cousin of the Higgs boson, one that inspired the decades-long hunt for the elusive particle, has been properly observed for the first time. The discovery bookends one of the most exciting eras in modern physics.	science
5ptcbv	Simulations of black holes have revealed the first superfluid specimen.	science
6vk675	Confirmed: Electrons flowing like liquid in graphene are extremely superconductive (Superballistic flow within graphene at the relatively warm temperature of 150 K (-123°C and -190°F) with resistance actually decreasing as temperature increased	science
6vfvhd	Electrons flowing like liquid in graphene start a new wave of physics	science
3qx7a4	Do you have a college degree or higher in science? Get flair indicating your expertise in /r/science!	science
6g7gdd	Einstein’s theory and ‘bent light’ reveal a way to weigh stars for first time. The scientists pointed the Hubble Space Telescope at a nearby binary star phenomenon called gravitational microlensing. That’s when gravity from a closer star slightly bends the light coming from a more distant star.	science
5y9i1u	New form of matter once thought to break laws of physics created by scientists - Strange material repeats a crystal-like structure in the fourth dimension, time, rather than just in space.	science
7df8mx	Pulsations in the Earth's Lower Ionosphere Synchronized With Solar Flare Emission - Hayes - 2017 - Journal of Geophysical Research: Space Physics	science
