6h1zq7	A research team has developed a graphene-based transistor that could someday lead to computers that are a thousand times faster and use a hundredth of the power	science
32sn8d	Science AMA Series: We're scientists on a NOAA ocean exploration mission to uncover the deepest, unseen parts of the Caribbean Sea. Ask Us Anything!	science
7u8t8m	A dinosaur discovery in Egypt has revealed an ancient link between Africa and Europe	science
7xe9jv	A new discovery pinpoints the part of the brain that triggers fear relapse, a finding that could advance the treatment of disorders like post-traumatic stress disorder.	science
41up8u	Astronomers have announced the potential discovery of "Planet X", a Neptune-sized ninth planet in our solar system	science
7s75sx	Scientists develop tractor beam capable for levitating objects larger than an acoustic wavelength. The discovery opens the door to the manipulation of drug capsules or micro-surgical implements within the human body. Container-less transportation of delicate larger samples is now also a possibility.	science
55t7so	Science AMA Series: We are 3 scientists who are collaborating on an open science project to find treatments for Zika. Ask Us Anything!	science
7j579i	An international team of scientists have confirmed the discovery of a major cause of dementia, with important implications for possible treatment and diagnosis.Dementia results in a progressive and irreversible loss of nerve cells and brain functioning	science
36lmqp	Old bones mend like youthful bones do when they're exposed to young blood after a fracture	science
8evpaf	Researchers detail discovery of a law they believe governs the evolution of all galaxy clusters. The law suggests that while galaxy clusters have been growing for between 4 and 8 billion years, they're still in adolescence.	science
8iefz1	Surprise Discovery Shows 'Artificial Atoms' Rapidly Self-Assembling Into Complex Structures	science
67m6df	New graphene based material has photosynthesis like qualities, on track to revolutionize solar technology	science
6g0kfv	MIT physicists have finally created a 2D magnet. Just one atom thick, the magnet will allow researchers to perform previously impossible experiments. The discovery is published in Nature today.	science
84gdue	Study find that mice lacking a protein in the brain called calnexin were completely resistant to developing multiple sclerosis. The discovery provides hope for a new therapeutic target in MS patients that could one day prevent the symptoms and progression of the disease.	science
818wey	A type of bacteria commonly found on human skin produces a substance that may help protect against skin cancer. Scientists say the surprise discovery regarding a strain of Staphylococcus epidermidis highlights the importance of the community microbes found on and in the body in preventing disease.	science
8ljsff	Discovery of Novel Enhancers of Isoniazid Toxicity in Mycobacterium tuberculosis	science
5xo15p	Researchers in Sweden have shown for the first time how the heart's ventricles fill up with blood	science
662cy2	Hi Reddit! I’m Lily Raines, Manager of the Office of Science Outreach at the American Chemical Society. Ask me anything about ACS’s special celebration for Earth Day this weekend!	science
6jicr3	Researchers have found a way around what was considered a fundamental limitation of physics for over 100 years. They discovered that more electromagnetic energy can be stored in wave-guiding systems than previously thought. The discovery has implications in telecommunications.	science
7n9jew	New Discovery: Scientists for the first time made visible to the naked eye and recorded on video radio waves with a novel nanomagnetic microscope	science
6e8812	Mars had liquid water for longer than previously thought. The discovery of silica 'halos' points to the existence of groundwater long after lakes evaporated and extends the planet’s potential window for life.	science
82iqw1	Researchers create model of the interior of a white dwarf star similar to our own sun. A telescope and instrument considered “vintage” by today’s standards allowed them to make a discovery that wouldn’t have been possible with only the advanced satellite instrument that collected the initial data.	science
8856ug	Underground neutrino experiment sets the stage for deep discovery about matter. Researchers showed that they can shield a sensitive, scalable 44kg germanium detector array from background radioactivity, which is critical to developing a much larger future experiment to study the nature of neutrinos.	science
8bz6fz	Phage Therapy in Bacterial Infections Treatment: One Hundred Years After the Discovery of Bacteriophages	science
6i7hfx	Scientists have identified a new gene associated with psychosis, after studying a family in which 10 members were suffering from symptoms of the psychiatric condition. The discovery may provide new insights into the biology of psychosis.	science
618g7f	Science AMA Series: We are scientists on board the JOIDES Resolution for International Ocean Discovery Program (IODP) Expedition 367: South China Sea Rifted Margin. We are exploring different ideas about plate tectonics and the break-up of continents and forming of ocean crust, AUA!	science
w0tty	Higgs Boson Confirmed at 5-sigma Standard Deviations at 125 GeV	science
5gs51b	New discovery shows that paleo diet was heavy plant based and had less meat than what modern cookbooks suggest	science
87u55s	Underground neutrino experiment sets the stage for deep discovery about matter	science
56k1zw	Scientists in California have found that earthquakes can occur much deeper below the Earth’s surface than originally believed, a discovery that alters their understanding of seismic behavior and potential risks.	science
86p4u5	Cell discovery could personalize treatment for glaucoma. For the first time, scientists identified a variety of previously unknown cell subtypes in the human eye. The cells are the neurons that take visual information from the eye to the brain for processing and interpretation, which is how we see.	science
5df8vg	Long-sought signal deepens mystery of fast radio bursts	science
883h8t	Discovery of a surprise multitasking gene helps explain how new functions and features evolve using exaption	science
87nzwp	Interesting recent discovery about our own bodies	science
6imfdy	Anti-Alzheimer’s Compounds Found in Medicinal Plant Using New Drug Discovery Strategy	science
83sx4u	Chemical con artists foil drug discovery	science
84tx32	The evolution of anticancer drug discovery from plants	science
3ozak4	Science AMA Series: I’m Zena Werb, I study cancer at the molecular level at UCSF. My lab is trying to uncover how cancer spreads through the body (metastasizes), which causes the majority of cancer deaths. We’re looking for new ways to fight rogue cancer cells, with a focus on breast cancer. AMA!	science
20w91i	Science AMA Series: I am Jon Kaufman, a member of team BICEP2 -- the telescope which has found evidence for Inflation after the Big Bang! Ask me anything!	science
3qjrpm	Discovery of genes involved in inner ear development hints at a way to restore hearing and balance	science
7u29w3	A new dinosaur discovery, described as “the most completely preserved land-living vertebrate” from the end of the Cretaceous Period ever found, could shed light on the final age of the dinosaur in Africa.	science
7nggr9	New Discovery: Scientists in the Technological Educational Institute of Crete succeeded in making radio waves visible to the eye with a nanomagnetic microscope	science
77u6jv	Fossil teeth discovery in Germany could re-write human history- "Their characteristics resemble African finds that are four to five million years younger than the fossils excavated in Eppelsheim. This is a tremendous stroke of luck, but also a great mystery."	science
2rqmtq	Science AMA Series: I'm Ian Sample, Science Editor at the Guardian and author of Massive, The Missing Particle that Sparked the Greatest Hunt in Science, AMA!	science
49i88b	American Chemical Society AMA: My name is Dee Strand, and I am the Chief Scientific Officer at Wildcat Discovery Technologies. Ask me your lithium ion battery questions!	science
5xao65	One step closer to immortality: Scientist discover mitochondria acts as a "guardian" against ageing and degenerative diseases, through new pathway of obliterating stress/aggregate proteins within the mitochondria. Authors coin this with acronym "MAGIC"	science
5zbhbe	Discovery of widespread platinum may help solve the disappearance of the Clovis people - study concluded that the most likely source of such platinum enrichment was from the impact of an extraterrestrial object.	science
7z7khj	Some articles and reviews of discoveries of the natural world of West Africa	science
6dgfih	Science AMA Series: Scientists are on board the JOIDES Resolution for International Ocean Discovery Program (IODP) Expedition 368: South China Sea Rifted Margin (Part B) to explore different ideas about plate tectonics and the break-up of continents and forming of ocean crust.	science
6llo1w	Mars covered in toxic chemicals that can wipe out living organisms, tests reveal. Discovery has major implications for hunt for alien life on the red planet as ESA prepares to dig deep with ExoMars rover	science
85n5qf	Researchers report on an unusual cell-death process, whose discovery could shed new light on how cells bury their dead.	science
603sj6	Scientists detects Lurking HIV in a Major Biomarker Discovery	science
6ajh0x	Scientists build a molecular Trojan horse that can penetrate gram-negative bacteria, by modifying a drug that kills only gram-positive bacteria into a broad-spectrum antibiotic that could also kill gram-negatives. The findings appear in the journal Nature.	science
6sjs32	During a walk near a reservoir in a small Japanese town, amateur collectors made the discovery of their lives – the first and oldest fossil bird ever identified in their country.	science
znm9c	CERN’s Higgs boson discovery passes peer review, becomes actual science. 	science
5xgg3b	Journalists unfairly show preferential treatment to scientists who are the first to report on a discovery, even if their research is wrong, and fail to follow up with another article if that finding proves later to be disproved, finds new research published in PLOS One.	science
2placa	Curiosity Rover Drills Into Mars Rock, Finds Water...and, in that same sample, the first discovery of organic compounds.	science
7sv8nn	UCLA researchers have provided the first description of the structure of the herpes virus associated with Kaposi’s sarcoma, a type of cancer. The discovery answers important questions about how the virus spreads and provides a potential roadmap for the development of antiviral drugs to combat it.	science
6pexh4	Bouncing balls on a hot pan led to a new physics discovery: Water droplets float in a hot pan because of the so-called Leidenfrost effect. Now, physicists have discovered a variation: the elastic Leidenfrost effect. It explains why hydrogel balls jump around on a hot plate making high-pitched sounds	science
55t61r	ACS AMA: We are Mat Todd and Alice E. Williamson, respectively founder and principal synthetic organic chemist for the Open Source Malaria (OSM) Consortium. Ask us anything about open source drug discovery, OSM’s recent paper and malaria medicines!	science
714z60	Researchers have discovered a new tri-anion particle, a type of particle with three more electrons than protons. The new particle is extremely stable and its discovery apply to a variety of applications in the fields of physics and chemistry.	science
79wwes	'Monster' planet discovery challenges formation theory. Previously thought to be too big to exist was found around a distant star	science
2kqhj3	New frog discovered inhabiting I-95 corridor from Connecticut to North Carolina	science
mmlll	A bizarre underwater "icicle of death" has been filmed by a BBC crew.	science
a9zdb	What is the single scientific discovery you most want to see in your lifetime?	science
3nk1or	Nobel Prize 2015 awarded to discoveries in parasite therapies	science
7u9ryq	Jack the Ripper Letters Were Fake News, Linguistic Analysis Suggests. Researchers have concluded that two of the earliest letters were written by the same person—a discovery which suggests unscrupulous journalists kickstarted the trend	science
xmuin	This is what we paid $9 billion for! Higgs Paper out	science
31w7f1	For the first time, astronomers have detected the presence of complex organic molecules, the building blocks of life, in a protoplanetary disc surrounding a young star. The discovery reaffirms that the conditions that spawned the Earth and Sun are not unique in the Universe.	science
5h0v16	NASA is recreating the very weird (and hellish/horrfying) conditions on the surface of Venus in Cleveland, Ohio	science
61pgeh	Mass Producing Artificial Blood now Possible with Breakthrough Discovery	science
4yd6r0	Pentaquark discovery confirmed. (According to LHCb collaboration)	science
32crju	New discovery may be breakthrough for hydrogen cars	science
85rp0x	Discovery of circa 115,000-year-old bone retouchers at Lingjing, Henan, China	science
3nzgt6	NASA: New Horizons Finds Blue Skies and Water Ice on Pluto.	science
6pzssh	Cleaning out ‘rust’ from the brain could be a way to slow and even prevent Alzheimer’s. The discovery that high iron levels in the brain can lead to the onset of the devastating disease may pave the way for a treatment.	science
7uemy2	Newly Discovery Anxiety Cells in a Hippocampal-Hypothalamic Circuit Increase Anxiety and Avoidance when Activated by Anxiogenic Environments	science
43319q	Discovery Of Most Powerful Supernova To Date, 570 billion times the luminosity of the sun	science
mcwxa	The episode of Frozen Planet viewers in the US won't see.	science
3k32wi	American Chemical Society AMA Series: I'm Mark Blaskovich, from Open Antimicrobial Drug Discovery. We help chemists around the world discover new antibiotics, ask me anything about antimicrobial resistance, the empty antibiotic discovery pipeline and the ‘superbug’ crisis. AMA!	science
2teeeg	Science AMA Series: We are Moore Investigators and We Utilize Data Science to Make New Discoveries. AUA.	science
2xo4jy	Germ-killing molecules identified in alligator blood: Over more than 37 million years, alligators have developed a formidable defence against infections that we might be able to harness.	science
7wdn0k	Discovery and validation of a glioblastoma co-expressed gene module	science
y269q	A New Species Discovered ... On Flickr	science
29dy1i	Astronomers report the discovery of a potentially habitable super-Earth exoplanet, Gliese 832 c, only 16 light-years away	science
vqoau	LHC discovers new particle (not the Higgs boson)	science
7syinr	Researchers report in Science the discovery of 10 new immune systems in bacteria. Molecular biologists are intrigued, and want to see whether any possess the utility of other bacterial defense systems, such as CRISPR.	science
10nv4h	New material may replace silicon. Norwegian researchers are the world’s first to develop a method for producing semiconductors from graphene. This finding may revolutionise the technology industry.	science
7pibmj	Discovery of Next-Generation Antimicrobials through Bacterial Self-Screening of Surface-Displayed Peptide Libraries	science
3g4c7v	Science AMA Series: Hi, I’m Jonathan Ling, a researcher that’s here to share our new breakthrough discovery for ALS (amyotrophic lateral sclerosis)	science
20mrz4	Cosmic inflation: 'Spectacular' discovery hailed "Researchers believe they have found the signal left in the sky by the super-rapid expansion of space that must have occurred just fractions of a second after everything came into being."	science
6uji4q	Researchers Make Surprising Discovery About How Neurons Talk to Each Other. The findings, made in fruit flies and mice, challenge existing dogma about how neurons communicate, and may have implications for many dopamine-related diseases, including schizophrenia, Parkinson’s disease, and addiction.	science
5cpo0i	Your breasts start to eat themselves after breastfeeding is over	science
7yrhd6	Low Data Drug Discovery with One-Shot Learning	science
7rlew5	Knowledge Discovery through Data mining (KDD) can help make sense of large amounts of complex climate data	science
7peqlw	Engineers grow functioning human muscle from skin cells. The ability to start from cellular scratch using non-muscle tissue will allow scientists to grow far more muscle cells, provide an easier path to genome editing, and develop tailored models of rare muscle diseases for drug discovery.	science
4tuija	Dingoes have been filmed eating each other, despite having other sources of food. The finding challenges the long-held assumption that animals only resort to cannibalism during famine. The discovery suggests that the subject of animal cannibalism needs to be reconsidered.	science
6nlq3w	Fluorine turns white graphene into a wide-bandgap semiconductor with magnetic properties. Rice University scientists said that could make the unique material suitable for electronics in extreme environments. The discovery is published in Science Advances.	science
6r8yfj	Surprise Discovery Shows 'Artificial Atoms' Rapidly Self-Assembling Into Complex Structures	science
2u8f57	Scientists discover that a protein in seminal fluid enables the mother's immune system to tolerate the fetus, this discovery is initiating the development of new treatments for recurrent miscarriage.	science
7elizm	New Discovery: Common Jellyfish Is Actually Two Species	science
3yvpgl	Are scientists a workforce? – Or, how Dr. Frankenstein made biomedical research sick	science
4xvl69	Physicists confirm possible discovery of revolutionary fifth force of nature which would "completely change our understanding of the universe"	science
67ty5p	The discovery of 25 dangerously pointy stone weapons in a South African cave shows that humans mastered a complex weapon-creating technique during the Stone Age, some 77,000 years ago, according to a new study.	science
6490ft	Giant virus discovery sparks debate over tree of life	science
bk4v6	First 7 TeV collisions have just taken place at the Large Hadron Collider (CERN)!	science
2fjzdk	Mother of Higgs boson found in superconductors: A weird theoretical cousin of the Higgs boson, one that inspired the decades-long hunt for the elusive particle, has been properly observed for the first time. The discovery bookends one of the most exciting eras in modern physics.	science
6ibse9	Discovery could lead to sustainable ethanol made from carbon dioxide	science
6nq53v	Scientists have reported the discovery of the smallest star ever found, detecting a star only slightly larger than Saturn some 600 light-years away from Earth.	science
ef2s6	Nasa to unveil new life form: Bacteria that thrive on arsenic [The Guardian]	science
igjum	Three US psychiatrists at Harvard Medical School and Massachusetts General Hospital, responsible for trailblazing the use of antipsychotic drugs in children, are facing sanctions for their failure to declare their acceptance of millions of dollars from pharmaceutical companies between 2000 and 2007	science
3qenay	American Chemical Society AMA: I am M.G. Finn, Editor-in-Chief of ACS Combinatorial Science, here to discuss why combi chem is not dead. Ask me anything!	science
594bet	No, the Universe is not expanding at an accelerated rate, say physicists	science
4r3jll	Uranium mining in Australia is polluting the Antarctic, about 6,000 nautical miles away. Climate scientists made the discovery during the first high-resolution continuous examination of a northern Antarctic Peninsula ice core.	science
pptts	World's Tiniest Chameleon Discovered	science
2q2oq2	Mathematicians Make a Major Discovery About Prime Numbers	science
51fs0g	Biochemists' discovery could lead to vaccine against 'flesh-eating' bacteria	science
6jvrbm	For the first time ever, astronomers say they’ve been able to observe and measure the orbital motion between two supermassive black holes hundreds of millions of light years from Earth – a discovery more than a decade in the making	science
1zrwg5	Researchers have found cannabinoid receptors, through which marijuana exerts its effects, in a key emotional hub in the brain involved in regulating anxiety and the flight-or-fight response. The discovery sheds new light on marijuana's anxiety relief effects.	science
6e7z4k	First cryo-electron microscopy images captured of key cellular receptor for diabetes in action. Findings reveal new information about workings of G protein-coupled receptors, which are targeted by about half of all drugs, and getting such structures will be crucial for further drug discovery efforts	science
7gd3vx	Gene discovery may reveal how scaly dinosaurs became feathery birds	science
