9g0n3g	The same researcher who 20 years ago made the discovery that linked abnormalities in egg chromosomes in mice to BPA, has just published a new study that found reproductive defects in mice housed in plastic cages made with BPA alternatives, suggesting that BPA-free products may not be safe.	science
9lqepq	Forests with a diverse mix of trees can absorb more than twice as much carbon as areas with just a single species, research has found – a discovery that could help in the fight against climate change.	science
9v9y7s	Like humans, rats selectively forget distracting memories, shows new study. This discovery suggests that the capacity to forget plays a vital role in adapting mammalian species to their environments, and that its evolution may date back at least to the time of our common ancestor.	science
8v90cr	Archaeologists uncover remains of a horrifying Iron Age battle in Denmark. Thirteen-year-olds fought side by side with adult men and the dead were left where they fell, ripped to pieces by hungry animals. One of the most startling discoveries was the four pelvic bones mounted on a stick.	science
9tm98x	Researchers have developed a new strategy in the search for psychoactive drugs. By analyzing the behavior of larval zebrafish, they can filter out substances with unwanted side effects right from the start. This method has resulted in the discovery of a number of new appetite modulators.	science
7x8i5l	New antibiotic family discovered in dirt - Tests show the compounds, called malacidins, annihilate several bacterial diseases that have become resistant to most existing antibiotics, including the superbug MRSA, as reported in Nature Microbiology.	science
9puz34	‘A new day for chemistry’: Molecular CT scan could dramatically speed drug discovery	science
9nuca0	New discovery restores insulin cell function in type 2 diabetes. By blocking a protein, VDAC1, in the insulin-producing beta cells, it is possible to restore their normal function in case of type 2 diabetes.	science
9rktol	Researchers have identified a new species of Archaeopteryx that is closer to modern birds in evolutionary terms. Known as the ‘Icon of Evolution’ and ‘the missing link’ between dinosaurs and birds, Archaeopteryx has become one of the most famous fossil discoveries in Palaeontology.	science
9vvcyx	EPFL scientists have uncovered that next to estrogen receptor-positive and -negative cells there are cells with very low amounts of the receptor protein. The discovery has significant implications for the role of the receptor in the growth and development of the breast and breast cancer.	science
9ao2cd	Report on two dinosaurs found in China, bridging 90M year evolutionary gap between early Alvarezsaur finds (3 major claws), new find (one major, 2 minor claws), later finds (one major, 2 tiny claws) - confirming the steady evolutionary reduction of claws between early and later fossil record	science
9t1666	Study identifies new area of the brain involved in inhibiting fear, a discovery that holds potential for clinical interventions in patients with psychiatric diseases such as PTSD.	science
95x5wp	New DNA discovery shows one way the rapid expansion of human brain size and cognitive abilities may have increased our susceptibility to psychiatric diseases, like bipolar and schizophrenia.	science
9kquah	The results of a new study suggest that, despite what thought after the gravitational waves discovery, none of the universe's dark matter consists of heavy black holes, or any similar object, including massive compact halo objects, so-called MACHOs	science
7j8d6x	Cockroaches change their gait at mid-speed, a behavior previously only observed in fast mammals. This change in gait is similar to the way horses change from trot to gallop. The discovery could help engineers train robots to walk more stably and efficiently.	science
9n7p4x	Discovery of new pathways by which eyes grow longer or shorter, causing nearsightedness and farsightedness: Gene expression in response to optical defocus of opposite signs reveals bidirectional mechanism of visually guided eye growth	science
9rctn3	While studying the critically endangered slender-snouted crocodile, researchers discovered what they thought was one species is actually two, making the discovery the first new living crocodile species to be defined and named in nearly 85 years.	science
9f9k5v	New class of antibiotics discovered that can combat multidrug-resistant infections of Gram-negative bacteria, such as E. coli. The discovery, confirmed in multiple mouse models, is the first of its kind in 50 years.	science
9sjk62	How a snake named Hannibal led to a discovery about cobra cannibalism	science
9cejub	Scientists decode opium poppy genome. The discovery may pave the way for scientists to improve yields and the disease resistance of the medicinal plant, securing a reliable and cheap supply of the most effective drugs for pain relief and palliative care.	science
8mdq9u	A new experimental discovery demonstrates that the chemical element ruthenium (Ru) is the fourth single element to have unique magnetic properties at room temperature	science
9kvabo	Discovery of new object supports theory of 'super-Earth' at edge of solar system	science
9rax4g	How a snake named Hannibal led to the discovery that cobras cannibalize each other far more than anyone had thought	science
9tbxwm	Study finds that 3 proteins regulate each other with surprising twists and turns in female mouse eggs. The unexpected complexity in how the proteins regulate one another doesn’t happen in any other healthy cell type. The discovery could play an important role in female infertility and cancer biology	science
921yrk	Paleontologists have identified that the Sauropod Dinosaur - which was previously not believed to have existed - belong to an East Asian dinosaur species named Lingwulong shenqi from the genus Diplodocus. They were part of the supercontinent Pangaea, which began to break apart about 175M years ago.	science
981ilx	Discovery of single key protein involved in the development of autism - Researchers discovered that CPEB4, a molecule that regulates protein synthesis, is impaired in most cases of autism. Defects in CPEB4 lead to the dysregulation in the expression of most of the 200 genes associated with autism.	science
9atgji	Extinct Cave Bear DNA Found in Living Bears. The discovery is the first of its kind outside the human lineage.	science
9pse9m	trying understand the size of this-new space discovery	science
9rb90c	An international team of astronomers reports the discovery of a new giant protocluster of galaxies at high redshift (z=5.7)	science
9lrsqc	Turbidity currents in submarine canyons often involve large-scale movement of the seafloor. This discovery could help ocean engineers avoid damage to pipelines, communications cables, and other seafloor structures.	science
71iigm	Science AMA Series: We are a group pf researchers that uses the MMO game Eve Online to identify Exoplanets in telescope data, we're Project Discovery: Exoplanets, Ask us Anything!	science
8zv9j3	For decades, researchers believed early humans first settled in the Western Hemisphere around 13,500 years ago. However, the discovery of 150,000 'unique' stone tools northwest of Austin, Texas, now suggests humans were living on the continent as far back as 20,000 years ago	science
7lt6rq	A discovery that microbes in Antarctica can scavenge hydrogen, carbon monoxide and carbon dioxide from the air to stay alive in such extreme conditions has implications for the search for life on other planets.	science
8p3zgq	Kepler2 has found two new planetary systems with 3 Earth-sized planets and 2 super-Earths	science
9lrlbu	The discovery of a small molecule that plays an important part of the HIV life cycle may lead to the development of new treatments for the virus.	science
9fu3vw	While last year's discovery of gravitational waves from colliding neutron stars was earth-shaking, it won't add extra dimensions to our understanding of the universe. Gravitational waves propagate in D=3+1 spacetime dimensions, as expected in general relativity	science
9ah0ld	Materials scientists use molecular models to demonstrate the theory that nanotubes of the right diameter can prompt water inside to solidify into a square tube, transitioning into a kind of ice. The discovery could lead to new types of nanochannels devices, like nanoscale capacitors or syringes.	science
9l417k	Using NASA’s Hubble and Kepler space telescopes, astronomers have uncovered tantalizing evidence of what could be the first discovery of a moon orbiting a planet outside our solar system	science
97bf0d	A team of astronomers led by George Becker at the University of California, Riverside, has made a surprising discovery: 12.5 billion years ago, the most opaque place in the universe contained relatively little matter.	science
87ke8z	Amazon Archeology Study Finds Millions Once Lived in Now Uninhabited Forest: "There is a common misconception that the Amazon is an untouched landscape, home to scattered, nomadic communities. This is not the case."	science
9ir2i5	Data from NASA's Cassini spacecraft has revealed what appear to be giant dust storms in equatorial regions of Saturn's moon Titan. The discovery makes Titan the third Solar System body, in addition to Earth and Mars, where dust storms have been observed.	science
8ubl8l	Complex organic molecules found on Saturn's moon Eceladus	science
9560u8	Scientists have finally found an elusive molecule that helps sperm find the egg. The discovery, observed in the cellular biology of sea urchins, isn't just important for marine invertebrates; the findings may reveal new secrets about human fertility that could also help us treat male infertility.	science
91mqxl	Quantum computers don't need to distinguish cause and effect, researchers claim in a discovery with implications for the nature of "Time's Arrow"	science
7aj2q8	Scientists find key to unwanted thoughts. The discovery may help explain why some people can't shift persistent intrusive thoughts - a common symptom of anxiety, post-traumatic stress disorder (PTSD), depression and schizophrenia.	science
8l0s2q	Robots grow mini-organs from human stem cells. A robotic approach to mass-producing organoids could accelerate regenerative medicine research and drug discovery.	science
9iv4ij	Liquid metal discovery to make toxic water safe and drinkable	science
8xoh9p	Genetic analysis of social-class mobility in five longitudinal studies: authors argue education GWAS discoveries which link genetics to educational attainment are not mere correlates of privilege; genetics influence social mobility within a life.	science
90z596	Scientists announce discovery of a a new genus and species of an ankylosaurid dinosaur, which was among the most heavily armored animals on Earth. The 76 million year old fossils show that it was a four-legged, armor-studded plant eater with a menacing club at the end of its tail.	science
9f5ysy	Insights into eyesight – discovery of retina regulatory molecules	science
8c4xef	Artificial intelligence accelerates discovery of metallic glass: A combination of machine learning and high-throughput experiments has resulted in the rapid discovery of three new glass-forming systems an estimated 200x faster than it could be done previously.	science
8p8dwj	Overtaxed Working Memory Knocks the Brain Out of Sync. Researchers find that when working memory gets overburdened, dialogue between three brain regions breaks down. The discovery provides new support for a broader theory about how the brain operates.	science
9favw1	Discovery of new neurons in the inner ear can lead to new therapies for hearing disorders	science
86f06q	Video of mating deep-sea anglerfish stuns biologists	science
7yh71r	Humans will actually react pretty well to news of alien life. Across multiple studies, researchers found that reactions were significantly more positive than negative, and more reward vs. risk oriented.	science
978y0q	A team of scientists has uncovered new molecular properties of water—a discovery of a phenomenon that had previously gone unnoticed.	science
99eqyq	Meet STEVE: Citizen scientists lead to the discovery of optical structure in the upper atmosphere	science
8cenm5	In a new study, ecologists and conservation scientists found that communicating their new research discoveries through social media, primarily Twitter, led to higher citations later, suggesting that citation rates are positively associated with science communication through social media.	science
6vsalb	New frog species discovered	science
8lgpne	Astronomers have just confirmed the discovery of the solar system’s first interstellar immigrant - Object orbiting the sun in the wrong direction took up residence billions of years ago.	science
8sq37d	A new cell type in the body’s fat depots can actively suppress fat cell formation. The discovery was made using single-cell transcriptomics and opens entirely new avenues to combat obesity and related diseases such as diabetes (paper in Nature).	science
76y7z6	Science AMA: We are the first people to observe neutron stars colliding that the LIGO team detected, we're the Swope Discovery Team, ask us anything about supernovas, astrophysics, and, of course, neutron star collisions, AMA!	science
9gwhmn	Discovery of Extended Infrared Emission around the Neutron Star RXJ0806.4–4123	science
7q7gmg	The Arc protein in the brain that is critical for memory consolidation started as a virus molecule millions of years ago.	science
63kz8g	PLOS Science Wednesday: Hi reddit, my name is Stefan Bengston and I recently found the world’s oldest plant-like fossil, which suggests multicellular life evolved much earlier than we previously thought – Ask Me Anything!	science
9b1h6f	Ancient parasitic wasps found in fossil fly pupae - Scientists reported the discovery of 55 cases of parasitation by four extinct wasp species. The parasitation events were found inside phosphatized fly pupae from the Paleogene, the period spanning 66 million years ago to 23 million years ago.	science
8a86z2	For the first time researchers have been able to determine the high-resolution structure of the large protein cage where Herpesvirus encloses the DNA genome, using electron microscopy at 3.1A. This structure guides the design of therapeutic agents for treating tumors and strategies against HSV.	science
9agizv	Scientific discoveries through the trivial	science
8vwoq7	Neuroscientists have identified the neural circuit that may underlay intelligence in birds, according to a new study. The discovery is an example of convergent evolution between the brains of birds and primates, with the potential to provide insight into the neural basis of human intelligence.	science
95wkml	Discovery of copper band shows Native Americans engaged in trade more extensively than previously thought	science
8y2uza	Discovery of key gene from "living fossil" plant Ephedra sinica enables bioproduction of decongestant medicine Pseudoephedrine in microorganisms for the first time	science
9bvivz	A new discovery could help grape growers roll back a devastating virus that withers vines and shrivels harvests. For the first time, researchers have found a way to clone leafroll 3, opening the door for experiments and treatments to protect valuable Washington vineyards.	science
7s588g	MIT researchers have discovered a way to triple the efficiency of devices that can harvest heat — produced as a byproduct of industrial processes and combustion engines — and turn that otherwise wasted heat into electricity, using “topological” materials, which have unique electronic properties.	science
92ipvb	Research has long associated poor sleep with an increased risk of depression, but scientists have just identified the neural mechanism responsible for this link – a discovery that could lead to better treatments in the future.	science
8r0pcc	For the first time, scientists can now predict who is susceptible to the flu before they are exposed to the virus. This comes with the discovery of a new blood-based flu biomarker.	science
8inaaa	Neuroscientists at Indiana University have reported the first evidence that non-human animals can mentally replay past events from memory. The discovery could help advance the development of new drugs to treat Alzheimer's disease.	science
906dj9	The first-ever discovery of an ancient snake embryo, preserved in 105-million-year-old amber, provides important new information on the evolution of modern snakes, according to a new study	science
9907jo	Scientists at the University of British Columbia have discovered that the Nipah virus and other similar viruses assemble themselves in a much more haphazard manner than previously thought. They made this discovery using their newly developed optical super-resolution microscope.	science
96x3kf	An integrated clinical program and crowdsourcing strategy for genomic sequencing and Mendelian disease gene discovery	science
8owcnb	"Some dogs in China carry a mixed bag of influenza viruses. The discovery raises the possibility that dogs may be able to pass the flu to people, perhaps setting off a pandemic."	science
93qc6y	Discovery of odorant genes in firebrats pushes back origin of insect sense of smell	science
8v38bh	New Discovery of How Crows Use Tools Could Change Our Understanding of Intelligence | Mental template matching is a potential cultural transmission mechanism for New Caledonian crow tool manufacturing traditions	science
8qx0yv	Mayo Clinic discovery is first step toward new bacteria-based constipation treatment	science
98u8eb	Tagged Walls: The Discovery of Ancient Maya Graffiti at El Castillo, Xunantunich	science
91lw5s	Discovery reveals how obesity causes disease -- and two ways to stop it: Finding points to new approaches to battling diabetes, other chronic conditions	science
904bzb	A robot instructed by a machine learning algorithm and coupled with real-time spectroscopic systems provides fast and accurate reaction outcome predictions and reactivity assessments, leading to the discovery of new reactions.	science
7dbipg	A potentially habitable world, termed Ross 128 b, has been discovered just 11 light years away. It is roughly Earth-sized and orbits its parent star once every 9.9 days. The astronomers reported the discovery in Astronomy and Astrophysics.	science
6nsp26	Science AMA Series: We’re Professor Kristine DeLong and documentary journalist Ben Raines, our discovery of a preserved underwater forest in the Gulf of Mexico that’s been submerged since an Ice Age 60,000 years ago when sea levels were 400 feet lower than they are today. Ask Us Anything!	science
90tcm5	Discovery of Calcium-60 & Implications For the Stability of Calcium-70	science
7qb8x0	Baking soda could help in the fight against antibiotic resistance. Researchers have discovered that the ion bicarbonate (baking soda) disrupts a bacterium’s energy system, increases the efficacy of some antibiotics, and could help in the discovery of new antimicrobials.	science
5sl0fy	Chemist have done what was considered impossible: they created the first stable compound with helium, using sodium	science
8vixwg	Researchers have identified a new gene that plays a critical role in regulating the body's immune response to infection and disease. The discovery could lead to the development of new treatments for influenza, arthritis, and even cancer.	science
7bhyf9	Old human cells rejuvenated in discovery on ageing - A new way to rejuvenate old cells in the laboratory, making them not only look younger, but start to behave more like young cells, has been discovered. Within hours of treatment the older cells started to divide, and had longer telomeres.	science
8bzass	Researchers find in a mouse study that norovirus has an affinity for intestinal tuft cells, a rare and not well understood cell type	science
77legf	Scientists worked out how many changes it takes to transform a healthy cell into a cancer: Just one mutation to drive thyroid and testicular cancers, four mutations to make a breast or liver cancer, and 10 mutations to create a colorectal cancer, as reported in journal Cell.	science
664ve9	A chemical in the mucus of South Indian frogs is capable of killing certain strains of the influenza virus. It will take awhile for scientists to translate this finding into a useful medicine, but the discovery could lead to an entirely new source of powerful anti-viral drugs.	science
6sdi5g	ACS AMA: Hi, Reddit! I am Donna Huryn, a medicinal chemist at the University of Pittsburgh’s School of Pharmacy. Ask me anything about medicinal chemistry / drug discovery in academia.	science
8xtd0e	Bhart-Anjan Bhullar, from Yale University, talks with us about how the discovery of a 95 million year old Ichthyornis fossil in 2014 revealed some unexpected insights into the minds — and mouths — of modern birds.	science
7yzl6o	Humans would react positively to finding alien life. A new study analyzed the optimism of articles about potential discoveries of alien life, as well as data from over 1,000 survey participants. "Taken together, this suggests if we find out we're not alone, we'll take the news rather well."	science
8uchuo	Change in brain cells linked to opiate addiction, narcolepsy. Two discoveries — one in the brains of people with heroin addiction and the other in the brains of sleepy mice — shed light on chemical messengers in the brain that regulate sleep and addiction, UCLA researchers say.	science
4btbyb	A species of cavefish has been documented walking and climbing waterfalls in a manner similar to four footed creatures, in a find researchers call “huge” in evolutionary terms. It has anatomical features previously known only in tetrapods, four-limbed vertebrates that include amphibians and reptiles	science
82o35o	Massive Astrophysical Objects Governed by Subatomic Equation: a surprising new discovery from a Caltech researcher suggests that the Schrödinger Equation—the fundamental equation of quantum mechanics—is remarkably useful in describing the long-term evolution of certain astronomical structures.	science
91c1ac	Gene discovery and polygenic prediction from a genome-wide association study of educational attainment in 1.1 million individuals	science
66jogo	In a new discovery, naked mole-rats can metabolize fructose like plants, allowing them to survive for over 5 hours deprived of oxygen. The finding has implications for heart attack and stroke treatments.	science
8u3x3d	UCLA researchers develop synthetic T cells that mimic form, function of human version. Discovery could be a step toward developing treatments for cancer and autoimmune diseases	science
6feeki	Neuroimaging study finds intolerance of uncertainty is linked to an enlarged striatum in the brain	science
72ke0a	Hi Reddit, I’m Debasish Bandyopadhyay of the University of Texas Rio Grande Valley. Ask me anything about natural products, organic medicinal chemistry, and drug discovery (synthetic and natural) following greener routes.	science
8p0rzk	Discovery of middleweight black holes could explain origin of million-solar-mass monsters	science
8d46xp	Characterization and engineering of a plastic-degrading aromatic polyesterase	science
8cvgj6	New research shows that children with malaria emit specific odor that attracts more malaria mosquitoes, leading to an increase in the risk that these and other nearby children are bitten. Through this discovery, scientist can now improve odor-baited traps for mosquitoes by adding specific compounds.	science
5mi3cr	Scientists discover concussion biomarker. Discovery takes guesswork out of concussion diagnosis and management.	science
8ddlm9	Scientists (EPFL) have examined a slice from a meteorite that contains large diamonds formed at high pressure. The study shows that the parent body from which the meteorite came was a planetary embryo of a size between Mercury to Mars. The discovery is published in Nature Communications.	science
6iselv	Scientists say they have found the first direct evidence that the immune system does attack the brain in Parkinson's disease. The discovery, in the journal Nature, suggests that drugs to calm the immune system could help manage the disease.	science
8jvedn	In unveiling rheumatoid arthritis’ epigenome, scientists made a surprising discovery: an overlap between the causes of RA and Huntington's disease	science
5jcd7l	A series of experiments showed that sudden insight may yield more correct solutions than using gradual, methodical thinking	science
66h4zq	Science AMA Series: I'm Derek Lowe - I've been doing drug discovery research in Pharma since 1989, and I'm the author of the oldest science blog on the internet, "In the Pipeline". Ask Me Anything!	science
57azz2	Spiders can hear sounds from 350 times the distance previously thought, even without eardrums. Researchers made the discovery when a chair squeaked while they were conducting another study.	science
2b4qvv	Discovery of fossilized soils on Mars adds to growing evidence that the planet may once have - and perhaps still does - harbor life	science
6503b1	Researchers have been able to capture the first composite image of a dark matter bridge that connects galaxies together.	science
8gjnvt	Research finds circuit in the brains of mice that link circadian rhythm and aggression. Researchers developed protein tools capable of turning off the cells in the brain causing the behavior. The discovery is particularly relevant to Alzheimer’s patients who experience increased aggression at night.	science
4l0njo	Neanderthals constructed complex subterranean buildings 175,000 years ago, a new archaeological discovery has found. Neanderthals built mysterious, fire-scorched rings of stalagmites 1,100 feet into a dark cave in southern France—a find that radically alters our understanding of Neanderthal culture.	science
