77zoyc	Physics Boosts AI Methods - Researchers report the first application of quantum computing to a physics problem. By employing quantum-compatible machine learning techniques, they developed a method of extracting a rare Higgs boson signal from copious noise data, as reported in Nature.	science
4x1pxq	LHC experiment MoEDAL closes in on search for magnetic particle	science
7a7v2k	The new thermodynamics: how quantum physics is bending the rules	science
7gv96i	When Physics Gives Multicellular Evolution a Leg Up by Breaking One -- physical tension, not biological progam, drives a nascent lifecycle	science
6o3zus	Strongly Enhanced Photovoltaic Performance and Defect Physics of Air-Stable Bismuth Oxyiodide, A Non-Toxic Alternative To Lead-Containing Perovskites In Next-Generation Solar Cells	science
5cvxf7	Science AMA Series: Can science publishing be free, open and transparent? We believe so! We are Quantum, the community-driven open journal for quantum science. Ask us about science publishing and what you'd want from a good journal, including ours.	science
6ocg21	IBM Scientists Observe Elusive Gravitational Effect in Solid-State Physics for the First Time	science
737zfs	Turning up the heat on electrons reveals an elusive physics phenomenon	science
6kckhr	Study applies principles of physics at the ocean’s surface to study how energy is transferred from the underlying wave to a particle on the surface,in this case, a surfer. Based upon the speed and geometry of the wave, you can find where on the wave the maximum acceleration, or ‘sweet spot,’ will be	science
4gzrn6	We're convinced that it "Free Will" exists, but new research suggests it might be nothing more than a trick the brain plays on itself.	science
7matds	Researchers have chemically imprinted polymer particles with DNA strands	science
3dkubx	An international team led by Princeton University scientists has discovered Weyl fermions, an elusive massless particle theorized 85 years ago. The particle could give rise to faster and more efficient electronics because of its unusual ability to behave as matter and antimatter inside a crystal	science
3v4wha	Science AMA Series: In 1915, Einstein published his general theory of relativity. How are scientists using Einstein's theory today? We cover physics and astronomy for Science News. Ask us anything!	science
3wym94	Science AMA Series: The discovery of a new particle called Weyl challenged our understanding of quantum field theory and was one of the Physics World’s 2015 Breakthroughs of the year. Mazhar Ali is here to answer your questions about Dirac and Weyl materials, physics, & chemistry	science
75d02b	New precision experiments using trapped molecular ions provide an alternative method for determining the electron's electric dipole moment, a possible window into physics beyond the standard model	science
4qexr6	PLOS Science Wednesday: Hi Reddit, we’re Roslyn Dakin and Suzanne Amador Kane. We published a study in PLOS ONE assessing the physics behind displays of courtship from male peacocks – Ask Us Anything!	science
603fyd	Toward a Quantum Theory of Humor - Researchers propose that cognitive humor can be modeled using the mathematical framework of quantum theory, based on an initial study involving 85 participant responses to 35 verbal pun jokes (as well as variants), published in Frontiers in Physics.	science
6bhpnc	Cosmic rays suggest dark matter is a self-annihilating WIMP	science
35rjoc	New shield makes certain types of searches for physics beyond Standard Model possible for first time	science
2u2rdb	Claims that climate models overestimate warming are "unfounded", study shows. Taking all 15-year time periods together, the average observed trend since 1900 is 0.086 degrees Celsius per decade. This is almost exactly in line with the model average of 0.088 degrees per decade.	science
6ur3vc	Groundbreaking Observation Confirms an Important Prediction of Quantum Physics	science
42ytv5	College students who are the most overconfident tend to major in political science, law, business, or economics.	science
74pzgy	Energy Against The Current On A Quantum Scale, Without Contradicting The Laws Of Physics	science
7h48q9	Cool physics of combining different types of superhydrophobia (lotus-effect & lubricated)	science
45ee9o	Scientists observe electrons in a metal behaving like a fluid. Graphene and its unique properties are offering scientists a new opportunity to coax divergent theories of physics into agreement.	science
3bec4x	Scientists predict the existence of a liquid analogue of graphene	science
6llc6p	Physicists find new but long conjectured Baryon particle	science
13znfk	Supersymmetry Fails Test, Forcing Physics to Seek New Ideas	science
40ocng	Secondary school physics teachers with little teaching experience handed out significantly poorer grades to girls than boys for the exact same performance. This was the conclusion drawn by an ETH learning specialist from a study she conducted in Switzerland, Germany and Austria.	science
6x4zl6	Only 4% of Science Conferences offset climate change impact - authors say environmental policies needed	science
1i2jxr	Math, Science Popular Until Students Realize They're Hard	science
2le1gw	By using plasma, scientists have worked out a method to shrink particle accelerators. Using it they are able to accelerate particles hundreds of times quicker than the LHC, even though the particle accelerator is only 30cm long.	science
567rxb	The laws of physics had set a 5-nanometer threshold on the size of transistor gates among conventional semiconductors. Researchers have succeeded in creating a transistor with a working 1-nanometer gate. For comparison, a strand of human hair is about 50,000 nanometers thick.	science
22s1on	New study of the physics behind fruit flies' sharp, banked turns could change how we build flying micro-robots, according to a paper published today in Science.	science
4yaia8	Wormholes Could Finally Unite Two of the Biggest Theories in Physics	science
64x2w9	Researchers developed a microprocessor based on a layer of just 3 atoms using a two-dimensional semiconductor	science
24j96u	Superheavy Element 117 Confirmed - One Step Closer to the Island of Stability (x-post from /r/chemistry)	science
26otuz	Science AMA Series: I am Shaun Hotchkiss, a theoretical cosmologist studying inflation and the large scale structure of the universe, AMA.	science
3nosbv	2015 Nobel Prize in Physics: Detection of Neutrino Oscillation	science
65ek9j	Material scientists have predicted and built two new magnetic materials, atom-by-atom, using high-throughput computational models. The success marks a new era for the large-scale design of new magnetic materials at unprecedented speed	science
1q5pw9	The biggest single problem of all of physics (relativity's gravity vs quantum mechanics) may soon be solved	science
1tuwh1	Electron 'antenna' tunes in to physics beyond Higgs: In making the most precise measurements ever of the shape of electrons, a team of scientists have raised severe doubts about several popular theories of what lies beyond the Higgs boson.	science
6oik52	Big Bang gravitational effect observed in lab crystal	science
50asaw	American Chemical Society AMA: I am Karl Booksh, a professor of chemistry and biochemistry at the University of Delaware. Ask me anything about getting more opportunities for people with disabilities into STEM careers!	science
24z16n	5 years of software development, 3 months running on 8000 processors, and we have a remarkably accurate model of our universe and its evolution	science
36qryk	Science AMA Series: I'm Mario Livio, astrophysicist at the Space Telescope Science Institute (which operates Hubble) and author of "Is God a Mathematician?" AMA!	science
78rjd9	Adding Electrons Causes Phase Change in 2D Crystal MoTe2 - Nature	science
6hgg95	Particle Physics Might Make Your Raw Milk Safer to Drink	science
4yakg1	This new equation might finally unite the two biggest theories in physics, physicist claims	science
1b1bj3	Michigan Technological University’s invisibility cloak researchers have done it again. They’ve moved the bar on one of the holy grails of physics: making objects invisible.	science
5fbrws	Crowd-funded physics paper suggests that a grand unified theory might be trivial: "An algebra, that simply encodes how stuff is moved around in space..."	science
3t0ge8	"Ultra-short X-ray pulses could shed new light on the fastest events in physics"	science
4ocs0a	New research claims that the EM Drive doesn't actually defy Newton's 3rd	science
3il6p3	Science AMA Series: We are Johnjoe McFadden and Jim Al-Khalili, professors of biology and physics respectively at the University of Surrey in the UK and joint authors of ‘Life on the Edge’. We are here today to talk about quantum biology. AMA!	science
2qj0qy	Finding faster-than-light particles by weighing them	science
1mm0g4	Physicists Discover Geometry Underlying Particle Physics	science
236ap1	Science AMA Series: I'm Chris Adami, the guy that figured out what happens to information in black holes. Ask me anything!	science
1splzh	Even when test scores go up, some cognitive abilities don’t: MIT neuroscientists find even high-performing schools don’t influence their students’ abstract reasoning	science
dwm2s	We Showed 'Troll Physics' Comics to a Physics Professor. Here's His Reaction.	science
6sd3e0	Thermonuclear reactions probed at stellar-core conditions with laser-based inertial-confinement fusion : Nature Physics : Nature Research	science
poz6w	The Large Hadron Collider will boost the energy of its collisions, with scientists hoping to find "new physics" and end debate about the Higgs boson.	science
2hb2xc	UNC scientist proves mathematically that black holes do not exist.	science
3whtfb	[Nature] Paradox at the heart of mathematics makes physics problem unanswerable	science
1wa4da	Nanoscale heat engine exceeds the standard Carnot efficiency limit.	science
13h3d7	Particle physicists confirm arrow of time — for B mesons. Researchers working with data from the Stanford Linear Accelerator Center’s particle physics experiment BaBar have used the data to make the first direct measurement confirming that time does not run the same forwards as backwards.	science
6busrl	Quantum Theory of Dark Energy: How the huge energy of quantum vacuum gravitates to drive the slow accelerating expansion of the Universe	science
65vdkj	Electromagnetic Duality Anomaly in Curved Spacetimes. "the net polarization of the quantum electromagnetic field is not conserved."	science
6t6q6i	This Handheld Detector Spotted A Never-Before-Seen Physics Phenomenon	science
2b0hpr	Is the universe a bubble? Let's check: Scientists are working to bring the multiverse hypothesis, which to some sounds like a fanciful tale, firmly into the realm of testable science	science
5cl37l	Physics. For first time, researchers see individual atoms keep away from each other or bunch up as pair	science
2mx34l	Some theories that unify gravity with the other forces predict that fundamental constants like the proton-to-electron mass ratio could vary over cosmic time. If they do, then the laws of physics aren't permanent. Measurements of single ions now yield new upper limits on such variations.	science
4eqeij	With the help of computer games, scientists have discovered that people can outperform computers at certain tasks in quantum physics, findings that may help bring extraordinarily powerful quantum computers one step closer to reality.	science
yvk6g	Dark matter has been detected for the first time according to a study led by one of University of Michigan's physics researchers, Jörg Dietrich.	science
2wonj7	Many education 'experts' in news stories lack expertise, study finds	science
3kzzz3	You're not irrational, you're just quantum probabilistic: Researchers explain human decision-making with physics theory	science
6da28x	Researchers have theoretically described two quantum states that are extraordinary in both the physics that define them and their visual appeal: a complex quantum system that simulates classical physics and a spellbinding necklace-like state.	science
3sahmk	New derivation of pi links quantum physics and pure math	science
3xwc6k	Researchers found the secret to synchronize an unlimited number of spintronic oscillators. Such devices are very promising for future applications requiring wideband functionality	science
1a9ywz	Scientists confident they have discovered the Higgs Boson. 	science
28t4h7	Another victory for the Standard Model of Physics. A study published today in Nature Physics further confirms the existence of the Higgs Boson, by proving for the first time that it breaks down into fermions.	science
6gcws5	Swift kick from a supernova could knock a black hole, Gravitational Waves hints at unexpected power from star explosion [Astronomy] [Physics]	science
6xf812	The emergent physics of animal locomotion	science
2cj8l5	"Turing molecules" Finally discovered. Not only did Alan Turing break the German Enigma and father modern computer science, but he also published a theory on the creation of life in the womb, a year before the structure of DNA was even known. After 62 years, his theories have been proven.	science
6ndiy4	Defying Dissolution: Discovery of Deep-Sea Scleractinian Coral Reefs in the North Pacific	science
2ll61h	Why scientists think completely unclassifiable and undiscovered life forms exist. There may be a fourth domain of life on Earth undetectable by current techniques.	science
64p7v3	Break through in nano photonics, new radiation emitter eliminates the electron velocity threshold. [Physics]	science
4py8nm	In a First, Quantum Computer Simulates High-Energy Physics	science
4wv7cf	Parts of your brain are wired to 'get' physics.	science
el2h5	Physics paper shows airport backscatter scanners won't see what they were designed to detect	science
1f9ha2	Quantum gravity takes singularity out of black holes. Applying a quantum theory of gravity to black holes eliminates the baffling singularity at their core, leaving behind what looks like an entry point to another universe	science
504wwz	Irish-led physics team finds way to make electrons 'fatter' at will	science
12a1bg	Beautiful physics: tying knots in light. New research published today seeks to push the discovery that light can be tied in knots to the next level.	science
17epn2	A controversial theory that the way we smell involves a quantum physics effect has received a boost, following experiments with human subjects.	science
t9ks2	The Physics of Spilled Coffee	science
2mdjzt	Science AMA Series: We are SLAC National Accelerator Laboratory staff scientist Dr. Mike Litos and Stanford Ph.D. student Spencer Gessner, our work was the topic of a popular reddit post about shrinking particle accelerators, AMA	science
3dhuor	Science AMA Series: I am Trey Wenger, a graduate student at the University of Virginia and the National Radio Astronomy Observatory studying the structure of our galaxy, the Milky Way. AMA!	science
5zmiq8	Distant galaxies are dominated by stars and gas - dark matter only present in very low quantities	science
1b3rtf	Harvard physicists have measured magnetic moment of a single antimatter particle	science
1wk4z3	Quantum Cloud Simulates Magnetic Monopole : Physicists have created and photographed an isolated north pole — a monopole — in a simulated magnetic field, bringing to life a thought experiment that first predicted the existence of actual magnetic monopoles more than 80 years ago.	science
9c1bn	A physicist claims to have solved one of the more persistent problems in physics: why time flows in only one direction	science
1x9qua	Beyond the Universe. In this article, theoretical physicist Laura Mersini-Houghton reveals the latest evidence for parallel universes from the Planck satellite. (x-post from r/physics)	science
bshc7	1200+ educational videos covering math, physics, chemistry etc. All made by Salman Khan.	science
1ywfmx	Scientists re-weigh the electron, get more precise mass "A precise value for the mass of the electron is one example of the sort of statistic that physicists are eager to collect ... a team of German physicists reported a new electron-mass measurement that offers a precision to parts per trillion."	science
2m27sm	Physicists have sent a beam of twisted light 3km through the air above Vienna. It is the first time that information has been transmitted outdoors using the "twist" of a visible light beam. Reported in the New Journal of Physics, the technique was tested by sending three images of famous Austrians.	science
4zvp9o	Jammed Cells Expose the Physics of Cancer	science
4dd96d	Quantum physics has just been found hiding in one of the most important mathematical models of all time, The Schrödinger equation	science
5b703y	Physicists Demonstrate Existence of Tetraneutron | Physics | Sci-News.com	science
3phbph	American Chemical Society AMA: I’m Lisa Balbes, Freelance Technical Writer/Editor and ACS Career Consultant here to discuss nontraditional careers for chemists. Ask me anything!	science
1cgix9	Researchers May Have Finally Detected a Dark Matter Particle - signal at the 3-sigma level, which indicates a 99.8 percent chance of an actual discovery — a “concrete hint,” as it’s being called.	science
4lliv0	Loop quantum gravity(LQG) theory offers glimpse beyond the event horizon. LQG attempts to describe the quantum properties of the universe and gravity. It is also a theory of quantum spacetime because, according to general relativity, gravity is a manifestation of the geometry of spacetime.	science
246dlw	Science AMA Series: I'm Stephen Larson, project coordinator for OpenWorm. We're an open science project building a virtual worm. AMA!	science
mg007	LHC May Have Found Crack in Modern Physics	science
vqoau	LHC discovers new particle (not the Higgs boson)	science
