41p6mp	Using food-web theory to conserve ecosystems : Nature Communications : Nature Publishing Group	science
78k9p	Over 1800 MIT Courses Online for Free (Many w/ video!)	science
36mmi7	The Mechanical Engineering Future Is Caught Up in a 3D-Printed Spider Web	science
asybu	"Hello Twitterverse! We r now LIVE tweeting from the International Space Station -- the 1st live tweet from Space!"	science
aqs26	Why do you support Google if you don't support teaching intelligent design?	science
atf41	The International Space Station crew can now use the internet to reach a desktop computer at Mission Control, and thereby browse the Web	science
a6f56	Coming Soon: Your head with an "Intel Inside" sticker on it.	science
6x5u3	A scientist who bought a fossilised insect on the web auction site eBay for £20 has discovered that it belongs to a previously unknown species of aphid. 	science
pvao9	Journal publishing reform - Polymath Wiki: collection of links to information, opinion, activism, and other issues concerning the practices of research journal publishers	science
93qkf	Stephen Hawking: A Brief History of Time (1991) | CosmoLearning Astronomy. Complete, in Standard and High Quality. Free to watch. Enjoy!	science
1w8p5a	UCSC Scientists Capture First Cosmic Web Filaments at Keck Observatory	science
9lofe	What kind of Spider is This?	science
rj6y6	Amazon Web Services will store the entire contents of the National Institutes of Health's 1000 Genomes Project, a survey of genetic information from 1,700 individuals that is some 200 terabytes in size.	science
1xi27n	Social media, self-esteem and suicide: Nations with more corruption demonstrate more social media, less suicide	science
3d4dfe	Male black widow spiders destroy female's web to deter rivals	science
qxvxv	Why Spiders Don't Stick To Their Own Webs	science
dcgbq	JOLECULE, a HTML5/javascript protein viewer that runs on the web	science
20jddw	In the universe galaxies align themselves into stands. Between those strands was thought to be emptiness. Until now. Now scientists have spotted filaments made up of galaxies between stands seemingly to keep the 3D structure of the cosmic web.	science
3u9rrd	Researchers have developed a mathematical model to forecast metastatic breast cancer survival rates using techniques usually reserved for weather prediction, financial forecasting and surfing the Web.	science
9znwn	140 million-yr-old spider web found encased in a Prehistoric piece of amber in the South of England	science
8no1p	Bizarre Anaerobic Ecosystems Discovered In Lake Huron	science
k9x95	Assassin bugs hunt spiders on their webs by stalking or luring their victims before stabbing them with their long, sharp snouts. 	science
ps92s	A Chemist Uses Google's Algorithm to Determine the Structure of Molecules -- Scientists want to find a use for PageRank in the world beyond the web.	science
dwzdo	Scientists have described how a species of insect, known as assassin bugs, lures spiders by mimicking prey caught in webs. 	science
3skza3	A fully automated behavioral intervention program by email, web, and mobile phone reduced patient's fasting glucose, HbA1c, weight and risk for diabetes in a randomized controlled trial among patients with prediabetes	science
5zhdr	Deadly risk of the ‘too posh to push’ mothers	science
65lmh	How are temperatures close to absolute zero achieved and measured.	science
27sac4	Spiders caught in the act of fine-tuning their webs like a guitar string; inspires new technologies such as tiny light-weight sensors.	science
3gp4uu	A Study of the Demographics of Web-Based Health-Related Social Media Users - health Web forums are dominated by female users, are generally older with the exception of the 65+ years bracket and blacks are underrepresented.	science
6n8hd	The Sunspot Enigma: The Sun is “Dead”—What Does it Mean for Earth?	science
afoy0	FREE ENERGY!	science
ae2qa	Can someone please tell me the exact amount of licks it takes to get to the center of a tootsie pop.	science
b3otn	LHC: The Comic	science
sljxi	New candidate genes for Lou Gherig's disease (ALS) discovered.	science
2qu5jz	Geoscientists aim to magnify specialized Web searching	science
mbdz1	Male nursery web spiders pay for sex and 'play dead'	science
pp0xh	Web freedoms fuel academic spring journal protest	science
28brpr	Social Web: Female Spiders Adopt 'Warrior' or 'Nanny' Roles	science
172273	The more polluted the environment, the more important biodiversity is for food web stability	science
6o704	 Right now, you're probably happy that you have the vast resources of the entire Internet at your fingertips. It's a feeling of power, isn't it? All that information	science
1eabvm	Seabird Bones Reveal Changes in Open-Ocean Food Chain	science
b7eas	Astronauts on the ISS can now surf the web	science
dgjvx	APOD Wallpaper: software that automatically updates your Windows desktop wallpaper from the Astronomy Picture of the Day (APOD) web site	science
1vo8sx	Distant Quasar Illuminates a Filament of the Cosmic Web	science
a6km6	The image may not appear, it may cause your Web browser to lock up, or it may crash your computer.  Wow universe, you crazy.	science
2a2atf	Study reveals strong links between Antarctic climate, food web	science
1sbu2e	Arctic study shows key marine food web species at risk from increasing CO2 - "Our study found that some marine animals may not be able to survive the impact of ocean acidification"	science
7waey	Best of The Web's Science and Technology Posts, Read What Made News in 2008.	science
24di5r	Unprecedented Images Show The "Dim Matter" That Connects All Galaxies | Using the Cosmic Web Imager, astronomers from Caltech have captured the first three-dimensional images of the intergalactic medium (IGM) — the diffuse gas that connects galaxies throughout the universe.	science
d4p2d	Cost of Weapons Grade U-235 anyone?	science
cpwks	Have questions about black holes? At 3:00 Eastern today (July 15), you can follow this link and log into live Web chat and get answers from a NASA scientist. 	science
20401k	Weirdness in cosmic web of the universe: Faint strings of galaxies in 'empty' space arranged in way never before seen	science
1gcznt	Mozilla launches Science Lab to help researchers transform scientific practice through the open Web	science
jf8z9	Mind-Controlling Wasps and Zombie Spiders: The spider is temporarily paralyzed as the wasp lays eggs on the tip of the spider’s abdomen. Later the larvae compels the spider to build a special reinforced web for them before killing the host	science
apk7p	Photos: massive spider discovered in Middle East is greatly endangered	science
7vq1b	(PIC) "The project was to record views of Bristol, with the sun trailing across the sky from the winter solstice (22nd December) to the summer solstice (the 20th of June)."	science
2dj8pn	How spiders fix their webs: Spider silk is light and delicate, while incredibly resilient and tear-resistant. Understanding the structure and way of construction of these threads is a challenge	science
1vm1z2	Distant quasar illuminates a filament of the cosmic web	science
750vn	Science needs to break free of its power-brokers and embrace a participatory web-based culture to boost innovation	science
